Canal,Nome vídeo,Data
Gela Rápido Dicas e Treinamentos, Cortar Tomada do Ar Condicionado Split PERDE A GARANTIA? Sim ou Não.,2021-01-13T23:29:28.307Z
Rofran Ar Condicionado, Ar Condicionado não gela??? Defeitos mais Comuns Ar Condicionado Antigo Janela acj,2021-01-13T23:23:20.892Z
Construa e conserte você mesmo, Fazendo a elétrica do ar condicionado corretamente.,2021-01-13T23:18:45.037Z
AIF Construções, Como Montar A Caixa de Tomada do Ar Condicionado,2021-01-13T23:18:07.633Z
EDIO FERRAZ, TOMADA COM DISJUNTOR PARA AR CONDICIONADO,2021-01-13T23:16:05.275Z
Super Felipe Channel," Como Resolver Tomada Esquentando e Derretendo - Secador, Aspirador de Pó, Chapinha",2021-01-13T23:14:30.514Z
Sulink Oficial, Tutorial - Troca do Plug/Conector Tomada Macho Energia Elétrica - SULINK,2021-01-13T23:13:14.247Z
Meteoro Brasil," BOLSONARO CHAMA BONNER DE CANALHA, DATENA REAGE",2021-01-13T18:13:43.146Z
SBT Jornalismo, Homem explode casa com seis policiais militares dentro em São Paulo | SBT Brasil (05/01/21),2021-01-09T21:40:22.963Z
Morning Show, JANAINA PASCHOAL - MORNING SHOW - 08/01/21,2021-01-08T21:22:12.961Z
Victor Bacchi, Como Eu Abri um Delivery de BATATA em 24 horas e Faturei 8  MIL no Mês,2021-01-08T19:27:03.716Z
Criolo, Criolo - Fellini (Lyric Video),2021-01-08T19:24:08.876Z
adsense, Globoplay + Canais Ao Vivo,2021-01-08T19:23:37.628Z
João Filho {Sacatruma}, ✅ LIVE com o Presidente Jair Bolsonaro — 07/01/2021,2021-01-08T17:35:15.932Z
Os Pingos nos Is, Comentaristas analisam live de Jair Bolsonaro de 07/01/21,2021-01-08T17:31:59.090Z
Jair Bolsonaro, Primeira Live de 2021 (07/01) - Presidente Jair Bolsonaro,2021-01-08T17:30:12.931Z
César Rocha Fotógrafo, URGENTE! BOLSONARO FALA DA PRORROGAÇÃO DO AUXÍLIO EMERGENCIAL AO VIVO SE PAGAR 5 MIL POR MÊS.,2021-01-08T17:25:46.967Z
adsense, a video that has been removed,2021-01-08T17:20:39.160Z
Canal do JEFINHO, 🚨AUXÍLIO EMERGENCIAL: PRESIDENTE FALA DA PRORROGAÇÃO E IRONIZA! VACINAÇÃO CONFIRMADA ! CONFIRA!,2021-01-08T17:16:59.506Z
adsense," Wabi Brasil - Suas compras na loja, com frete gratuito.",2021-01-08T17:16:39.076Z
Via Infinda, Morando em um Posto de Gasolina,2021-01-08T17:14:17.597Z
Via Infinda, COMO FAZER 1000 REAIS EM 1 SEMANA! Dinheiro rápido e fácil sozinho - 4 MIL REAIS POR MÊS,2021-01-08T17:07:04.319Z
adsense, https://www.youtube.com/watch?v=R-scCJfsB58,2021-01-08T15:45:56.784Z
Treta News, Igão e Mítico se separam do Flow Podcast e são duramente criticados,2021-01-08T15:37:37.272Z
Instituto Montanari, 08/01 AUXÍLIO EMERGENCIAL BOLSA FAMÍLIA AMPLIAÇÃO PRORROGAÇÃO GANHA FORÇA VACINAÇÃO CONFIRMADA,2021-01-08T15:31:00.940Z
adsense, https://www.youtube.com/watch?v=6cEr--hoLts,2021-01-08T15:26:03.228Z
YouTube Viewers, How to add a thumbnail to your video using the YouTube Studio app,2021-01-08T15:10:43.362Z
adsense, https://www.youtube.com/watch?v=26apXv8JAw0,2021-01-07T16:12:31.396Z
adsense, https://www.youtube.com/watch?v=g-WrOfwC53M,2021-01-07T16:11:08.941Z
Canal do JEFINHO, PRORROGAÇÃO DO AUXÍLIO EMERGENCIAL JÁ FOI CONFIRMADA?? NOVA PROPOSTA 4X R$600 É PROTOCOLADA! VEJA!,2021-01-07T16:10:12.530Z
Progressista," Ciro Gomes sobre ""Bolsonaro: Brasil está quebrado e não pode fazer nada?"" e ""mídia é inimiga?""",2021-01-07T16:07:49.390Z
Rádio BandNews FM," Andreazza analisa fala de Bolsonaro de que o ""Brasil está quebrado""",2021-01-07T16:06:19.719Z
adsense, a video that has been removed,2021-01-07T16:04:15.015Z
Os Pingos nos Is, Bolsonaro faz importante alerta sobre a economia,2021-01-07T16:03:13.331Z
Foco do Brasil," Presidente Jair Bolsonaro fala sobre seu Acidente, Auxílio Emergencial, Pressão",2021-01-07T16:02:48.193Z
TV BrasilGov, Presidente Bolsonaro fala sobre o auxílio emergencial,2021-01-07T16:02:20.851Z
tvbrasil, Auxílio Emergencial compensa perda da renda dos brasileiros,2021-01-07T15:58:07.533Z
tvbrasil, Cerimônia de Prorrogação do Auxílio Emergencial,2021-01-07T15:57:55.679Z
Tenho Direito?," BOLSA FAMÍLIA: ""NOVO"" AUXÍLIO EMERGENCIAL A PARTIR DE 2021? GOVERNO DEBATE E VALOR PODE AUMENTAR...",2021-01-07T15:56:24.058Z
Instituto Montanari, 07/01 AUXÍLIO EMERGENCIAL BOLSA FAMÍLIA PRORROGAÇÃO CANDIDATO DE MAIA VACINAÇÃO EM JANEIRO,2021-01-07T15:53:46.289Z
Tenho Direito?, SAIU NA BAND! PRORROGAÇÃO DO AUXÍLIO EMERGENCIAL? | DATENA FAZ APELO A BOLSONARO...AGORA É PRESSÃO,2021-01-07T15:53:30.168Z
Tasso Henrique Brandão, PRORROGAÇÃO DO AUXÍLIO EMERGENCIAL EM 2021 | ÚLTIMAS NOTÍCIAS (06/01/2021),2021-01-07T15:53:13.386Z
João Financeira, SURPRESA! Bolsonaro DECLAROU Prorrogar o Auxílio Emergencial 2021 + 6 meses?? VEJA E ENTENDA!,2021-01-07T15:52:05.710Z
Predella CG," predella ta sem flow, coitado!",2021-01-06T00:54:11.158Z
adsense, a video that has been removed,2021-01-06T00:53:19.239Z
Cortes do Flow [OFICIAL], HOT E OREIA SÃO DESCONSTRUÍDOS? | Cortes do Flow,2021-01-06T00:52:38.875Z
Charles Santos, HOT e CASO DE ABUS4... (ENTENDA O CASO),2021-01-05T17:12:01.486Z
Podcasts Legendados, LANA RHOADES FALA PORQUE PAROU DE GRAVAR P*RNÔ | LEGENDADO,2021-01-05T17:08:40.169Z
Rap 24 Horas TV, OROCHI COM SEGURANÇA FORTEMENTE ARMADA EM SHOW NA FAVELA DA VILA VINTÉM,2021-01-05T17:05:54.656Z
adsense,Visited market://details?id=com.kwai.video,2021-01-05T16:32:07.466Z
Glaudimar Pedroza, Reagindo a Desmanches da Zona Leste - Delegado Dacunha em OPERAÇÃO POLICIAL,2021-01-05T16:29:10.242Z
Glaudimar Pedroza, Reagindo a Tiroteio assusta moradores do Bairro Salgueiro em São Gonçalo - Factual RJ,2021-01-05T16:27:39.627Z
adsense, https://www.youtube.com/watch?v=Oc923CDnXhU,2021-01-05T16:20:03.602Z
Poxalulu, VAZOU TEMA REDAÇÃO ENEM 2020? l SPOILER INEP,2021-01-05T16:18:03.409Z
adsense, PT.30 sec.1920x1080. Phone in hands. Buy & Profit. Start Investing.,2021-01-05T16:17:26.975Z
MC Marley," MC MARLEY - AI UI, UI AI / MACONHA, COCAÍNA, LOLÓ E TUDO MAS",2021-01-04T22:34:06.461Z
adsense, https://www.youtube.com/watch?v=tkZRBb2yf3k,2021-01-04T22:33:11.291Z
F A V E L A Movies, MC Menor da VG - Noite Regada a Cocaína/Sexta Feira Vou pro Baile (DJ Pereira),2021-01-04T22:31:45.311Z
ABC Fluent, NÍVEL 0 - AULA 4 - INGLÊS PARA INICIANTES,2021-01-03T21:07:07.652Z
ABC Fluent, NÍVEL 0 - AULA 3 - INGLÊS PARA INICIANTES,2021-01-03T04:03:52.032Z
ABC Fluent, NÍVEL 0 - AULA 2 - INGLÊS PARA INICIANTES,2021-01-03T03:43:18.683Z
ABC Fluent, NÍVEL 0 - AULA 1 - INGLÊS PARA INICIANTES,2021-01-03T03:10:40.042Z
Dicas de Inglês by Diou, COMO FALAR INGLÊS FLUENTE - DICA INFALÍVEL,2021-01-03T03:09:02.146Z
Quadro Móvel, APPS INCRÍVEIS E TOTALMENTE GRÁTIS PARA EDITAR VÍDEO COM O CELULAR ( Você precisa ver isso),2020-12-31T05:39:38.171Z
Samuel Pereira, O MELHOR APP DE EDIÇÃO DE VÍDEO PARA CELULAR  |  EDITOR DE VÍDEO PARA CELULAR,2020-12-31T05:39:07.570Z
PrimoCast, Quanto dinheiro ganha o Flow podcast? - PrimoCast 92 | O Podcast do Primo Rico,2020-12-31T05:34:45.399Z
cuphead MEMES, Aluno toma banho durante a aula online meme (Caique/kaike) 😂,2020-12-31T05:34:15.377Z
Helder Ibanez, O Maluco Tá Putaço,2020-12-31T05:13:47.162Z
Reagindo, YTPBR - O Maluco tá Malukasso,2020-12-31T05:11:42.267Z
Brasil Comedy News, POLICIAL APREENDE L0L0 E CHEIRA,2020-12-31T05:09:39.631Z
Cortes do Flow-Verso, PANICO NA TV FOI UM ERRO | DANIEL ZUKERMAN no Flow Podcast,2020-12-31T05:01:43.463Z
CANAL DISS BRASIL, Mano Brown Acabando com Sonho de Predella,2020-12-31T04:59:14.955Z
Talk Flow, CONVIDADO QUERENDO VAZAR IRRITA IGOR E MONARK,2020-12-31T04:55:10.309Z
Mundo da Elétrica, Tomada esquentando e derretendo! O que fazer?,2020-12-30T22:27:57.145Z
Ivan Santos, TOMADAS AQUECENDO.  PORQUE?,2020-12-30T22:26:15.881Z
Mundo da Elétrica," Disjuntor para ar condicionado - Dimensionamento, cabos e tomada!",2020-12-30T19:53:40.711Z
Yuri Kyllyw, 🔴GOVERNO ANÚNCIO NO ÚLTIMO MINUTO PRORROGAÇÃO DO AUXILIO EMERGÊNCIA ATÉ MARÇO DE 2021 ? veja agora,2020-12-30T14:21:20.175Z
Instituto Montanari, 30/12 AUXÍLIO EMERGENCIAL BOLSA FAMÍLIA PRORROGAÇÃO +PRESSÃO COMO SE INSCREVER NO BOLSA FAMÍLIA 2021,2020-12-30T13:40:10.206Z
Instituto Montanari, 27/12 NOVA PRORROGAÇÃO? AUXÍLIO EMERGENCIAL VOCÊ PRECISA SABER DISSO! PL PROTOCOLADO E BOLSA FAMÍLIA,2020-12-30T01:58:05.716Z
CHconstrução, Traço  forte de massa para chumbar em geral.,2020-12-28T22:28:38.215Z
RH & Business, ✔ 27/12 NOVA PRORROGAÇÃO? AUXILIO EMERGENCIAL 2021 INFORMAÇÕES IMPORTANTES,2020-12-28T14:45:08.365Z
Advogado e Professor Roberto Conceição," MUDANÇAS BOLSA FAMÍLIA E AUXÍLIO EMERGENCIAL A PARTIR DE JANEIRO 2021| ""novo valor"" | calendário",2020-12-28T14:43:49.077Z
César Rocha Fotógrafo," AUXÍLIO EMERGENCIAL 2021; Rodrigo Maia, governo abandonou preocupação controle dos gastos públicos.",2020-12-28T14:43:09.992Z
Tenho Direito?," ""NOVA"" PRORROGAÇÃO ATÉ MARÇO DE 2021 AUXÍLIO EMERGENCIAL E BOLSA FAMÍLIA PROTOCOLADA! ENTENDA",2020-12-28T14:25:20.034Z
iAconteceu," BANCO BMG CONTA DIGITAL e CARTÃO DE CRÉDITO, Vale a pena? Quais são os seus benefícios? Em detalhe",2020-12-28T00:55:56.281Z
Flow Compilações, DILERA NO FLOW | MELHORES MOMENTOS,2020-12-26T13:47:31.087Z
Pânico Retrô, O GENIAL DILERA FEZ TODO MUNDO PASSAR MAL DE RIR NO PÂNICO | Pânico 2020 - Ep. 307,2020-12-26T13:35:54.778Z
Flow Compilações, FROID APARECE NO FLOW DO NADA E CHOCA CONVIDADO | MELHORES DA SEMANA,2020-12-26T13:28:30.645Z
adsense, a video that has been removed,2020-12-21T15:43:56.575Z
Pamela Divulgações, NEGO MAX PASSA A VISÃO PARA ICE BLUE RACIONAIS TRETA,2020-12-21T15:39:54.885Z
Diário de Biologia & História, 🧪 LEUCÓCITOS ALTOS NO SANGUE? O que pode ser?,2020-12-21T14:40:54.190Z
FLOW NA VEIA, YURI MARÇAL - PIADA COM GENTE BRANCA *tem gente que não entende* |  FLOW NA VEIA,2020-12-21T07:00:34.964Z
Cortes do Flow [OFICIAL], RELACIONAMENTO INTERRACIAL | Cortes do Flow,2020-12-21T06:52:39.974Z
Talk Flow, DEBATE CALOROSO ENTRE MONARK E AYU BRASIL - DIFERENÇAS ENTRE HOMENS E MULHERES,2020-12-21T06:50:16.951Z
Cortes do Flow [OFICIAL], COMO É O PROCESSO PRA ENTRAR NO BBB? | Cortes do Flow,2020-12-21T06:50:00.281Z
Talk Flow, SOBRE FELIPE NETO,2020-12-21T06:38:21.057Z
Talk Flow, SOBRE XBOX MIL GRAU,2020-12-21T06:28:48.056Z
Cortes do Flow [OFICIAL], O FLOW COMETEU UM ERRO AO CHAMAR O XBOX MIL GRAU? | Cortes do Flow,2020-12-21T06:18:00.762Z
Cortes do Flow [OFICIAL], O TWEET QUE DESTRUIU A XBOX MIL GRAU | Cortes do Flow,2020-12-21T06:10:27.784Z
Cortes do Flow [OFICIAL], CRÍTICAS ÀS PIADAS DA XMG | Cortes do Flow,2020-12-21T05:58:58.768Z
Cortes do Flow [OFICIAL], XBOX MIL GRAU LEVANDO BRONCA | Cortes do Flow,2020-12-21T05:49:56.551Z
Flow Pocket 2, CLIMA ESQUENTA ENTRE IGOR 3K E XCAPIM | Flow Pocket,2020-12-21T05:44:41.371Z
Cortes do Flow [OFICIAL], IGOR E MONARK CRITICAM A TOXICIDADE DO CONVIDADO | Cortes do Flow,2020-12-21T05:42:35.236Z
Cortes do Flow [OFICIAL], CONVIDADO OFENDE MONARK E IGOR | Cortes do Flow,2020-12-21T05:40:45.382Z
Cortes Podpah [OFICIAL], IRMÃOS NETO,2020-12-21T05:36:43.151Z
Talk Flow, MÍTICO EXPONDO LUCCAS NETO,2020-12-21T05:33:53.480Z
Cortes do Flow [OFICIAL], A VERDADE SOBRE O CARÁTER DE LUCCAS NETO | Cortes do Flow,2020-12-21T05:28:13.008Z
Cortes do Flow [OFICIAL], VIDEOS DE INDIANOS CONSTRUINDO PISCINAS SÃO FAKE? | Cortes do Flow,2020-12-21T05:23:37.904Z
MC NEGÃO DA BL, Ou você pula no mistério ou você incorpora numa bixa kkkkk,2020-12-21T05:22:10.172Z
NaLata Driver, UBER AO VIVO NA MADRUGA #15 - DOMINGOU,2020-12-21T05:21:11.653Z
Cortes do Flow [OFICIAL], TRETAS DO FLOW PODCAST | Cortes do Flow,2020-12-21T05:12:15.610Z
adsense, https://www.youtube.com/watch?v=LlbqBDCGm7k,2020-12-21T05:08:37.030Z
Master Tech Jr, Como instalar Globo Play e Telecine Play em qualquer TV Box Android,2020-12-21T02:07:12.567Z
Master Tech Jr, Como Instalar o App Globo Play em qualquer TV BOX Android,2020-12-21T02:07:07.435Z
Tecnologias Diversas, Problema com aplicativo Telecine no Tvbox (Solucionado) 2020,2020-12-21T02:01:27.126Z
Hoopie88, Long Cool Woman in a Black Dress - The Hollies,2020-12-20T21:47:58.195Z
Criolo, Criolo & Tropkillaz - Sistema Obtuso,2020-12-19T14:56:34.060Z
Tenho Direito?, 19/12 AUXÍLIO EMERGENCIAL E BOLSA FAMÍLIA: 13º SALÁRIO ABONO NATALINO | MP 1000 | BOLSONARO X MAIA,2020-12-19T14:54:27.580Z
Instituto Montanari, 19/12 - 13º BOLSA FAMÍLIA AUXÍLIO EMERGENCIAL GOVERNO SE PRONUNCIA! VEJA O QUE ELES DISSERAM!,2020-12-19T14:39:34.028Z
Flow Pocket 2, ATÉ ONDE O CIÚME É SAUDÁVEL EMME WHITE? | Flow Pocket,2020-12-18T18:03:04.714Z
Flow Pocket 2, EMME WHITE FALA VERDADES SOBRE O SITE BRASILEIRINHAS | Flow Pocket,2020-12-18T18:01:53.680Z
Flow Pocket 2, EMME WHITE E O INSTAGRAM | Flow Pocket,2020-12-18T17:59:08.594Z
adsense, a video that has been removed,2020-12-18T17:57:43.319Z
Balanço Geral MG, Homem debocha de currículos recebidos para vaga de emprego,2020-12-18T17:56:37.415Z
SBT Jornalismo, Turista australiano se aventura com traficantes no Complexo do Alemão | Primeiro Impacto (21/08/19),2020-12-18T17:52:05.105Z
SBT Jornalismo, Policial infiltrado mostra rotina de um dos traficantes mais perigosos do RJ | SBT Brasil (14/11/20),2020-12-18T17:44:07.069Z
TOP PLEY, Traficante da rocinha é pego dormindo na hora do plantão,2020-12-18T17:43:15.278Z
Cortes Podcast, COMO É TRABALHAR NA GLOBO | Cortes Podcast,2020-12-18T17:39:45.181Z
adsense, https://www.youtube.com/watch?v=Np9MnYISVqQ,2020-12-18T17:39:44.100Z
Talk Flow, MURILO COUTO SOBRE FELIPE NETO,2020-12-18T17:33:39.612Z
adsense, https://www.youtube.com/watch?v=SDTNyeIYK1I,2020-12-18T17:32:24.533Z
Aquele Flau [OFICIAL], DANILO GENTILI E SUAS ADVOGADAS,2020-12-18T06:08:12.547Z
Cortes do Flow [OFICIAL]," MONARK CONFRONTA MULHER DO IGOR, E O CLIMA? ESQUENTOU? | Cortes do Flow",2020-12-18T06:04:06.232Z
adsense, https://www.youtube.com/watch?v=cmrGNhEBJQ4,2020-12-18T06:01:34.219Z
Flow Pocket 2, DREAD HOT E SEU GEMIDO DE ALIEN | Flow Pocket,2020-12-18T05:58:57.057Z
Cortes do Flow [OFICIAL], DREAD HOT FALA OS PEDIDOS DE FÃS ESTRANHOS | Cortes do Flow,2020-12-18T05:56:44.956Z
Flow Pocket 2, IGOR 3K FICA CHOCADO COM DREAD HOT | Flow Pocket,2020-12-18T05:52:18.277Z
Flow Pocket 2, O HOMEM REALMENTE É IMPORTANTE NA HORA DO S3XO GRUPAL? EMME WHITE | Flow Pocket,2020-12-18T05:50:07.267Z
Flow Pocket 2, EMME WHITE NÃO GOSTA DO ALEXANDRE FROTA? | Flow Pocket,2020-12-18T05:47:58.925Z
Flow Pocket 2, EMME WHITE MANDA RECADO PARA OS FANS | Flow Pocket,2020-12-18T05:45:23.841Z
Flow Pocket 2, POR QUE EMME WHITE TEM BIRRA DAS FEMINISTAS RADICAIS? | Flow Pocket,2020-12-18T05:43:20.744Z
Flow Pocket 2," O QUE DREAD HOT ACHA DO SITE ""SUICID3GIRLS""? | Flow Pocket",2020-12-18T05:40:31.519Z
adsense, https://www.youtube.com/watch?v=H63JBZALYm8,2020-12-18T05:32:36.729Z
Metaforando, O Caso PC Siqueira (Análise de Linguagem Corporal - Metaforando),2020-12-18T05:26:36.881Z
Canal2 - Maicon Küster, PC SIQUEIRA VOLTOU COMPLETAMENTE LOUCO,2020-12-18T05:22:57.669Z
TODO MUNDO ODEIA PC SIQUEIRA," Trocando Registro, Mariposa e Cotonete",2020-12-18T05:21:40.409Z
Cortes do Flow [OFICIAL], CAUÊ MOURA SOBRE PC SIQUEIRA | Cortes do Flow,2020-12-18T05:20:01.534Z
Cortes do Flow [OFICIAL], PC SIQUEIRA | Cortes do Flow,2020-12-18T05:11:15.843Z
Cortes do Master [OFICIAL], CASO DO PC SIQUEIRA | Cortes do Master,2020-12-18T05:07:02.239Z
Cortes Podcast, RAFINHA E CAUÊ DISCUTEM SOBRE PC SIQUEIRA | Cortes Podcast,2020-12-18T04:59:35.874Z
Willian Stucker Eu quero saber mais, PC Siqueira - Ouça o áudio (EXCLUSIVO),2020-12-18T04:56:01.418Z
Rafi Bastos, SOBRE O CASO DO PC SIQUEIRA,2020-12-18T04:45:22.470Z
Jane Loures Canal de culinária," Pipoca doce,fácil e rápida de fazer..Assista ao vídeo para conferir..",2020-12-17T00:27:33.124Z
Perseguidora de Sonhos, PUDIM NO POTE - OS 2 SABORES MAIS VENDIDOS - FAÇA E VENDA,2020-12-16T22:06:40.347Z
Perseguidora de Sonhos," FAÇA ESSE PUDIM DE PRESTÍGIO NO POTE, É TOP, DELICIOSOOO",2020-12-16T22:06:34.389Z
Rick Sanchez, Changing 1 to 0 - Rick and Morty [season 3],2020-12-16T20:22:09.359Z
Talk Flow, RAFINHA BASTOS E DANILO GENTILI,2020-12-15T22:56:35.470Z
Mauricio Meirelles, EU GOSTO MUITO DO WHINDERSON NUNES - ACHISMOS COM RAFINHA BASTOS #2,2020-12-15T22:37:05.132Z
Talk Flow, TRETA COM RAFINHA BASTOS,2020-12-15T22:25:08.169Z
SLS DICAS E VLOGS," VENDA POR 1,00 E LUCRE 100% SORVETE DE CHOCOLATE NO POTINHO MUITO CREMOSO",2020-12-14T15:55:51.156Z
SLS DICAS E VLOGS, VENDA POR 1.00 REAL E LUCRE 100% 30 POTES DE SORVETE COM 1 PACOTINHO DE TANG,2020-12-14T15:54:35.058Z
Perseguidora de Sonhos," FAÇA ESSE PUDIM DE PRESTÍGIO NO POTE, É TOP, DELICIOSOOO",2020-12-14T14:29:18.380Z
Perseguidora de Sonhos, PUDIM NO POTE - OS 2 SABORES MAIS VENDIDOS - FAÇA E VENDA,2020-12-14T14:29:09.516Z
Perseguidora de Sonhos," ESSA SOBREMESA É UM SUCESSO   COPO DA FELICIDADE, COPUDIM",2020-12-14T14:28:44.133Z
Perseguidora de Sonhos, TORTA DE FRANGO no Pote (com pão) Faça e Venda - Ganhe uma Renda Extra,2020-12-14T14:23:00.271Z
Universidade Financeira, Como Sacar Dinheiro no Cartão de Crédito + Como Funciona o SAQUE Com o Cartão de Crédito,2020-12-13T15:35:45.367Z
Italo Conrado, COMO SACAR TODO O LIMITE DO CARTÃO DE CREDITO - [MÉTODO 2021],2020-12-13T15:33:10.183Z
adsense, Parcele tudo em até 12x com PicPay!,2020-12-13T15:30:27.667Z
POR DENTRO E POR FORA MOTOS, HONDA BIS 125 OU YAMAHA NEO 125 COMPARATIVO 2018,2020-12-13T05:18:45.812Z
Easy Way Motos," Avaliação: Pop 110i 2019 - Consumo, Painel, Design e mais!",2020-12-13T04:55:17.420Z
ZÉ DO RELO, QUEM TEM POP 110 i TEM QUE SABER DISSO - DICAS DO ZÉ DA POP,2020-12-13T04:43:14.800Z
Domadores de Cilindradas, Pop 110 | AINDA VALE A PENA COMPRAR ?,2020-12-13T04:39:54.196Z
Trader Faixa Preta, ALAVANCAGEM DE R$ 70 PARA R$ 1.600 EM 35 MINUTOS.,2020-12-13T04:16:50.315Z
adsense, a video that has been removed,2020-12-13T04:11:34.858Z
Como Ganhar Dinheiro na Internet – Lu Masati," Seja PAGO para baixar arquivos GRÁTIS + R$40,00 por CADA ARQUIVO / Como ganhar dinheiro na internet",2020-12-12T21:02:02.145Z
adsense, a video that has been removed,2020-12-12T19:49:43.338Z
Planeta Mágico, CAIXA TEM:  É NECESSÁRIO REGULARIZAR O SEU ACESSO. PROCURE UMA AGÊNCIA DA CAIXA. [APP CAIXA TEM],2020-12-12T18:17:11.230Z
Gilson Moraes, COMO LIBERAR ACESSO DO CAIXA TEM DE UMA VEZ POR TODAS!,2020-12-12T18:16:56.959Z
WILLIAM FERREIRA lıl," COMO CORRIGIR O ERRO, É NECESSÁRIO REGULARIZAR O SEU ACESSO. PROCURE UMA AGÊNCIA DA CAIXA.",2020-12-12T18:08:22.225Z
Post Tutoriais , Resolvido -  É necessário regularizar seu acesso procure uma agência,2020-12-12T17:44:55.470Z
AQUI VOCÊ SABE !, Caixa tem e necessário regularizar seu acesso procure uma agência COMO RESOLVER,2020-12-12T17:31:51.168Z
FAVELADO INVESTIDOR, QUANTO INVESTIR PARA VIVER DE RENDA COM FIIS (EXEMPLOS REAIS) || FAVELADO INVESTIDOR,2020-12-12T14:28:05.052Z
FAVELADO INVESTIDOR, 3 INVESTIMENTOS SEGUROS PARA INICIANTES (COMECE COM POUCO DINHEIRO),2020-12-12T14:17:31.969Z
FAVELADO INVESTIDOR, COMO RECEBER 3 SALÁRIOS MÍNIMOS DE ALUGUEL DE FUNDOS IMOBILIÁRIOS (ISENTO DE IR),2020-12-12T14:17:20.574Z
Gerando Poder, Nenhum Brasileiro Aprendeu Isso Na Escola | Empreendedor Flávio Augusto da Silva,2020-12-12T14:04:32.285Z
Seu Crédito Digital, DÍVIDAS CADUCADAS CONTINUAM TE IMPEDINDO DE CONSEGUIR CARTÃO? 😱😱,2020-12-12T13:58:50.733Z
Cortes do Flow [OFICIAL], FAVELADO INVESTIDOR | Cortes do Flow,2020-12-12T13:34:41.089Z
Talk Flow," EU NÃO FIQUEI RICO, FIQUEI MUITO RICO",2020-12-12T13:25:44.424Z
Seu Crédito Digital, 8 OU 80? AFINAL QUANTOS CARTÕES DE CRÉDITO É RECOMENDÁVEL TER?,2020-12-12T13:19:44.371Z
BudPlay, TODAS AS MENSAGENS POR TRÁS DE PONTA DE LANÇA | Rincon Sapiência,2020-12-12T13:19:01.282Z
Flow Compilações, DISCUSSÕES F0D4S DO FLOW #01,2020-12-12T13:18:06.733Z
MC NEGÃO DA BL, Ae não deixa ninguém mexer na barricada não em 🤣🤣🤣🤣🤣,2020-12-12T13:16:53.734Z
Cortes do Flow [OFICIAL], HISTÓRIA DE CAMELÔ | Cortes do Flow,2020-12-12T03:28:03.915Z
MC NEGÃO DA BL, Os amigos tá falando cmg e se brotar é bala😂😂,2020-12-12T03:26:28.149Z
De Sola," ""NUNCA MAIS QUERO VER EDUARDO STERBLITCH NA MINHA VIDA"" - BOLA no Alê Responde #165",2020-12-12T03:24:07.932Z
Mauricio Meirelles, INVADI O COMÍCIO DO BOULOS E ME PASSEI POR ELE!,2020-12-12T03:17:17.566Z
Mundo Cultural, O SEU ERRO É SER BONZINHO | A Filosofia De Maquiavel,2020-12-12T03:14:02.181Z
NeuroVox, O Ego É Teu Maior Inimigo | PEDRO CALABREZ,2020-12-11T14:58:40.225Z
NeuroVox, Como funciona o cérebro? | Parte 1: Neurônios | PEDRO CALABREZ | NeuroVox 009,2020-12-11T14:58:32.133Z
Produccine, ✅ Como colocar CAPA NO VIDEO do Youtube pelo PC!,2020-12-10T15:44:57.078Z
TV Afiada," FHC: ""o pessoal do sopão sempre vai existir""",2020-12-10T14:55:50.768Z
adsense, a video that has been removed,2020-12-10T14:41:33.567Z
Montar um Negócio, 10 COISAS PARA COMPRAR COM 200 REAIS E REVENDER,2020-12-10T14:28:23.951Z
Lidia Duarte - Ganhar Dinheiro Mais, Como Fazer RENDA EXTRA na Internet de R$200 a R$600 mesmo SEM EXPERIÊNCIA investindo ZERO reais!,2020-12-10T14:07:06.744Z
Tomazine420, FUMO MAIS que MATUÊ e MONARK ??? ONU Legalizou !?,2020-12-10T04:47:34.422Z
Darkscythe, Knives restoration suggestions,2020-12-10T03:51:12.356Z
VLADIATOR, PSG vs ISTANBUL - Who IS the RACIST?  Pierre Webo vs Referee,2020-12-10T03:51:05.251Z
Full, ISSO É A COISA MAIS INACREDITÁVEL QUE EU JÁ VI!!! JOGO DO PSG CANCELADO POR RACISMO DO ÁRBITRO!!,2020-12-10T03:49:29.331Z
Aluminio Fortaleza, Sua panela não pega pressão? Dicas aqui!,2020-12-08T20:51:46.829Z
Flow Podcast, FROID - Flow Podcast #157,2020-12-08T12:07:15.374Z
Talk Flow, PROJOTA SOBRE FROID,2020-12-08T12:03:28.448Z
Mateus Freitas Contábil, Abono Salarial do PIS - Valor Pago Sendo Para quem Não Conseguiu Movimentar o Saldo,2020-12-08T12:02:15.527Z
Hot e Oreia, Hot e Oreia - Domingo l Presença,2020-12-08T11:50:40.455Z
Guilherme Boulos, #BoulosNoFlow | Na íntegra,2020-12-07T23:00:18.029Z
Guilherme Boulos, Guilherme Boulos no PodPah,2020-12-07T22:59:48.228Z
Flow Compilações, BOULOS NO FLOW | MELHORES MOMENTOS,2020-12-07T22:57:19.593Z
Flow Compilações, DISCUSSÕES F0D4S DO FLOW #03,2020-12-07T22:46:44.999Z
Flow Compilações, DISCUSSÕES F0D4S DO FLOW #02,2020-12-07T22:38:25.575Z
Flow Compilações, MARCELO D2 NO FLOW | MELHORES MOMENTOS,2020-12-07T22:30:50.046Z
Flow Compilações, DISCUSSÕES F0D4S DO FLOW #05,2020-12-07T22:20:39.764Z
Flow Compilações, O CLIMA ESQUENTOU - AS MAIORES TRETAS DO FLOW PODCAST,2020-12-07T22:13:45.928Z
Talk Flow, CRISTÃO É PRECONCEITUOSO?,2020-12-07T22:02:46.261Z
Cortes do Flow [OFICIAL], UMBANDA E CANDOMBLÉ | Cortes do Flow,2020-12-07T21:46:07.263Z
adsense, https://www.youtube.com/watch?v=tuH4cQWq2Pw,2020-12-07T21:41:23.164Z
Quadro Móvel, MELHOR APLICATIVO PARA GRAVAR ÁUDIO COM CELULAR.,2020-12-07T21:34:32.090Z
Higor, COMO BAIXAR VÍDEOS DO YOUTUBE (PELO CELULAR/ANDROID),2020-12-07T21:28:16.690Z
adsense, Natal 2020 - O Boticário,2020-12-07T21:26:30.838Z
Grande Virada, Ganhe DINHEIRO NO YOUTUBE Com Músicas Grátis,2020-12-07T21:14:32.188Z
Imperio Milionario, Como Ganhar Dinheiro no Youtube Copiando e Colando,2020-12-07T21:07:55.060Z
TheChacal547, Gatinho Fofo Aventuras - Desenhos Animados Divertidos,2020-12-07T20:58:39.124Z
Tempojunto, TOP 10 BRINCADEIRAS PARA CRIANÇAS DE 5 A 6 ANOS,2020-12-07T20:56:43.344Z
R.i.R, MINIONS para Crianças Rir até não Aguentar,2020-12-07T20:56:27.407Z
adsense, Comprovado! Creative Commons Monetiza sim! Postei um vídeo creative Commons em um canal Monetizado!,2020-12-07T20:53:31.799Z
Nerds de Negócios, 9 ERROS QUE YOUTUBERS INICIANTES COMETEM,2020-12-07T18:28:13.115Z
Megapixelers, Direitos Autorais do YouTube - TUDO sobre musica para videos,2020-12-07T18:18:52.762Z
Erivelton, COMO criar CANAL de MÚSICA 2021 Atualizado sem PROBLEMAS COM direitos Autorais,2020-12-07T18:18:10.278Z
Nerds de Negócios, O SEGREDO PARA MONETIZAR O CANAL MAIS RÁPIDO,2020-12-07T17:50:07.869Z
andrew nunes, Moriá - Leonardo Gonçalves LETRA,2020-12-07T12:19:36.219Z
MyNews, CPI DO JESUS GAY,2020-12-06T17:03:47.027Z
Netflix Brasil, Especial de Natal Porta dos Fundos: Reagindo a Lucifer | Netflix,2020-12-06T17:00:50.892Z
Porta dos Fundos, ESPECIAL DE NATAL - O VELHO TESTAMENTO,2020-12-06T17:00:15.123Z
Porta dos Fundos, (TRAILER OFICIAL) TEOCRACIA EM VERTIGEM - ESPECIAL DE NATAL,2020-12-06T16:57:38.757Z
Dionathan Machado - EMPREENDEDOR DIGITAL, 🔜 O Melhor SITE (APLICATIVO) Para GANHAR DINHEIRO No MUNDO│Como Ganhar Dinheiro Online no YOUTUBE $,2020-12-06T13:48:38.378Z
Seu Crédito Digital, A VERDADE SOBRE COMO TER UM SCORE DE CRÉDITO COM 1000 PONTOS ✅✅,2020-12-06T13:45:10.731Z
Seu Crédito Digital, Esse é o MELHOR EMPRÉSTIMO online | BOM PRA CRÉDITO,2020-12-06T13:40:10.612Z
Seu Crédito Digital," EMPRÉSTIMO RÁPIDO, FÁCIL E S/ BUROCRACIA",2020-12-06T13:28:01.328Z
Grupo Teixeira, Prazo Para Saque do Abono do PIS,2020-12-05T21:37:32.255Z
SemstressTv, Matuê fala sobre Djonga e feat com Raffa Moreira.,2020-12-03T18:22:08.168Z
Mateus Freitas Contábil, Consulta dos Pagamentos do Abono Salarial do PIS - Devido aos Ajustes no Sistema da Caixa Econômica,2020-12-03T18:17:26.843Z
Mateus Freitas Contábil, Pagamento do Abono Salarial do PIS - Quem Vai Receber no dia 08/12 Previsto Pelo Governo Federal?,2020-12-03T18:13:06.252Z
NandãoXJ6, IFOOD ENTREGADOR DUAS ENTREGAS  EM UMA SÓ,2020-12-02T21:10:56.427Z
Entregador de Lanches, IFOOD ENTREGADOR: MOTOCA COMEU O PEDIDO DO CLIENTE!! E AGORA?,2020-12-02T21:02:02.142Z
Mega Curioso, 4 sintomas que você pode sentir antes de ter um ATAQUE CARDÍACO!,2020-12-02T16:03:50.783Z
Mulheres, Conheça os SINAIS antes de um infarto - Mulheres (21/02/19),2020-12-02T16:03:37.308Z
INCRÍVEL, 10 Sinais Alarmantes De Que O Seu Coração Não Está Funcionando Direito,2020-12-02T03:21:01.510Z
Saúde da Mente, Sintomas da Crise de Ansiedade,2020-12-02T03:20:46.682Z
MyNews, SAIBA QUAIS OS SINAIS E COMO EVITAR O ATAQUE CARDÍACO,2020-12-02T03:17:30.274Z
Secretaria de Estado da Saúde de SC, Dica de Saúde: sinais do ataque cardíaco,2020-12-02T03:14:26.970Z
