Canal,Nome vídeo,Data
Academia Hopper, Trabalhando com arquivos em Python com Serialização JSON,2021-04-19T00:44:33.258Z
Curso em Vídeo, Curso Python #19 - Dicionários,2021-04-19T00:41:13.916Z
Script Deep;, Curso Python - Função Len e Métodos de Lista,2021-04-18T23:19:31.648Z
Cursos Kane Chan, Variáveis String e função len em Python,2021-04-18T23:18:13.718Z
Solyd Offensive Security, Aula 12 - Requisições Web - Python Básico Solyd,2021-04-18T23:06:38.207Z
Phils Beginner Code," 2020 How to Fix ""No Module Named..."" Error in Python | Python Tutorial",2021-04-18T23:06:12.109Z
ATOM, How to Install requests module in Python 3 on Windows 10/8/7,2021-04-18T23:06:02.677Z
Online Code Coaching, No Module Named Requests FIXED - Pycharm or Komodo edit,2021-04-18T23:05:41.921Z
Rafael Galleani, Começando em Python #2 - Fazendo requisições GET e POST usando API de bots do Telegram!,2021-04-18T22:47:53.080Z
Bóson Treinamentos, Modelagem de Dados - Modelo Entidade-Relacionamento e Diagrama ER,2021-04-18T18:36:45.060Z
Cortes do Enxuga Gelo [OFICIAL], A VERDADEIRA HISTÓRIA DO FROID | Cortes do Enxuga Gelo,2021-04-18T18:26:23.423Z
Cortes Podpah [OFICIAL], CENA DE S3X0 COM A BÁRBARA PAZ,2021-04-18T18:19:36.774Z
Prod. Ttheuz1n," (FREE) Teto x Jovem Dex x Reid Type Beat - ""Travel"" (Prod. Ttheuz1n)",2021-04-18T14:37:59.912Z
Prod. Ttheuz1n," (FREE) [GUITAR] Aimar x Teto x Jovem Dex Type Beat - ""Florida"" (Prod. Ttheuz1n x Tkd)",2021-04-18T14:35:28.869Z
Prod. Ttheuz1n," (FREE) Teto x Gunna x Sidoka Type Beat - ""Rolex"" (Prod. Ttheuz1n)",2021-04-18T14:31:17.166Z
OficialHungria, Hungria Hip Hop - Legacy (Official Music Video),2021-04-18T14:30:34.179Z
Bagua Records," Long Beatz feat Xamã , Ryan Realcria - A noite",2021-04-18T14:30:07.016Z
30PRAUM, Matuê - Gorilla Roxo,2021-04-18T14:29:44.313Z
Di Bala, Di Bala - Flagrante,2021-04-18T14:28:39.454Z
Salvador da Rima, Salvador - “Vergonha Pra Mídia” (Feat. MC Ryan SP/Nog/Kevin/Lele JP) [Prod. Dj Boy/Nine/Ramiro],2021-04-18T14:22:00.855Z
OQ Produções, Kawe & Lele JP - MDS ( Prod Jay OQ ) Original Quality,2021-04-18T14:20:02.708Z
Malibu Studios," Malibu || Onde Você Mora - Ferrugem, Gaab, Vitão & Keviin",2021-04-18T14:20:00.009Z
Filipe Ret, Filipe Ret - F*F*M*,2021-04-18T14:18:11.172Z
CodeShow, TOP 5 EXTENSÕES PYTHON PARA O VSCODE - Codeshow #009,2021-04-18T13:58:40.617Z
trapzada, TZ DA CORONEL - ANOTA PLACA (ÁUDIO OFICIAL),2021-04-18T10:07:41.354Z
Satélite Funk, Menor MC - Tipo Gringa feat. DJ Matt-D,2021-04-18T10:05:45.546Z
L7NNON, L7NNON - Freio da Blazer 🚨 (prod. Ajaxx & Galdino),2021-04-18T10:02:41.575Z
Nathan Ribeiro, Tudo que eu quero - Nathan Ribeiro (Áudio oficial),2021-04-18T10:02:16.071Z
30PRAUM, Teto - M4 feat. Matuê,2021-04-18T09:59:24.909Z
Ed Sheeran, Ed Sheeran - Perfect (Official Music Video),2021-04-18T09:58:53.655Z
BillieEilishVEVO," Billie Eilish, Khalid - lovely",2021-04-18T09:55:16.773Z
Otávio Miranda, Ambiente virtual Python no Windows (usando venv e VS Code),2021-04-18T09:49:44.242Z
Descomplica, O que é Semântica? - Extensivo Português | Descomplica,2021-04-16T14:51:58.180Z
EdukaTI, Modelagem de Banco de Dados: Cardinalidade de relacionamento 1:1,2021-04-16T14:42:14.865Z
EdukaTI, Modelagem de Banco de Dados: Cardinalidade de relacionamento 1:n,2021-04-16T14:25:08.584Z
Otávio Miranda, Ambiente virtual Python no Windows (usando venv e VS Code),2021-04-15T19:51:08.849Z
Eletrônica e Programação, Como enviar Requisicões HTTP com Python,2021-04-15T19:33:22.061Z
Otávio Miranda, Consumindo uma API Rest usando requests em Python,2021-04-15T19:30:45.520Z
Programando Com Roger, Como criar uma api em python com flask - Tutorial Python Iniciantes 1,2021-04-15T19:30:07.367Z
Tempero Drag," A TEORIA DO APEGO (ou ""qual é o seu tipo?"")",2021-04-15T19:13:12.329Z
Meteoro Brasil, O BUDA DE OSAMU TEZUKA,2021-04-15T19:01:35.908Z
Meteoro Brasil, SURUBA NO AIRBNB GERA ESPORRO DE PROPRIETÁRIA,2021-04-15T18:45:12.130Z
HBO Brasil, GREG NEWS | COVARDIA,2021-04-15T18:44:31.648Z
Meteoro Brasil, SERGIO MORO QUER DANILO GENTILI PRESIDENTE,2021-04-15T17:42:02.215Z
Meteoro Brasil, O BRASIL É SUA PRISÃO,2021-04-15T17:16:44.560Z
Meteoro Brasil," FLAGRADO PROMOVENDO AGLOMERAÇÃO, DONO DA HAVAN DIZ QUE NÃO PROMOVEU AGLOMERAÇÃO",2021-04-15T17:02:44.583Z
Meteoro Brasil, KAJURU & BOLSONARO: QUE TRETA É ESSA?,2021-04-15T14:02:37.787Z
Meteoro Brasil," ACUADO POR CPI, BOLSONARO AMEAÇA INSTITUIÇÕES",2021-04-15T14:02:24.464Z
Rafael Laurindo, Consumindo API com Python e consultando endereço pelo CEP,2021-04-15T13:20:55.634Z
Otávio Miranda, Configurando o VS Code para Python,2021-04-15T12:12:12.414Z
Programação Dinâmica, Criando AMBIENTES VIRTUAIS para PYTHON,2021-04-15T11:18:00.785Z
Programação Dinâmica, Criando AMBIENTES VIRTUAIS para PYTHON,2021-04-15T00:02:58.813Z
Rafael Laurindo, Consumindo API com Python e consultando endereço pelo CEP,2021-04-14T23:52:50.727Z
Otávio Miranda, Consumindo uma API Rest usando requests em Python,2021-04-14T23:44:00.872Z
Sprouts, Experiential Learning: How We All Learn Naturally,2021-04-14T23:17:28.068Z
ixi Buguei, UBER EATS : Você não se qualifica para essa promoção 😡,2021-04-14T23:05:13.743Z
Prochan, PODEMOS DIRIGIR O TREM DO GTA 5!?,2021-04-14T22:52:30.671Z
VAGAS .com, Como preencher o currículo online [com exemplos] | VAGAS.com,2021-04-14T14:34:54.292Z
JeRsEyReBoX, UM NOVO DESAFIO!!! X CHALLENGE - Mega Man X Legacy Collection PTBR,2021-04-14T02:44:19.399Z
Prochan, PODEMOS DIRIGIR O TREM DO GTA 5!?,2021-04-14T00:55:26.429Z
NandãoXJ6, IFOOD SESI CURSO QUE FAZ TOCAR CORRIDAS?,2021-04-14T00:43:44.951Z
Bóson Treinamentos, Modelagem de Dados - Modelo Entidade-Relacionamento e Diagrama ER,2021-04-14T00:14:44.781Z
Cara Preta, Treinamento Método Grandão - Aumento e grossura em semanas-Método Grandão Funciona Falando a verdade,2021-04-13T18:02:06.500Z
Talk Flow, AS BIZARRICES DA UCRÂNIA,2021-04-13T17:36:23.542Z
Fala Brasil, Saiba por que Vinhedo é a cidade mais segura do Brasil,2021-04-13T13:35:58.935Z
Uadir Tech., Aplicativo Banco do Brasil e Ame🤔,2021-04-13T13:24:04.045Z
JeRsEyReBoX, UM NOVO DESAFIO!!! X CHALLENGE - Mega Man X Legacy Collection PTBR,2021-04-13T02:15:20.703Z
Prochan, PODEMOS DIRIGIR O TREM DO GTA 5!?,2021-04-13T02:12:38.088Z
Flow Compilações, EDUARDO BOLSONARO NO FLOW | MELHORES MOMENTOS,2021-04-12T23:22:34.079Z
Flow Compilações, FLOW DEBATE FEROZMENTE COM DEPUTADA DO PSOL | MELHORES MOMENTOS,2021-04-12T23:09:21.513Z
Henry Bugalho, PÁTRIA EDUCADORA: ENTENDA O OBJETIVO DO BRASIL PARALELO!,2021-04-12T23:04:54.396Z
Brasil Paralelo, A Primeira Arte - Teaser Oficial,2021-04-12T23:04:14.646Z
Casados na Estrada, Trilha na SERRA do VULCÃO de MOTO - Nova Iguaçu/RJ,2021-04-12T22:50:11.106Z
DICAS DE TREKKING, Serra do Vulcão - Rampa de Voo Livre de  Nova Iguaçu,2021-04-12T22:39:28.380Z
Sesc RJ, Turismo na Baixada - Parque Natural Municipal de Nova Iguaçu (Parque do Vulcão) | #SescRJLazer,2021-04-12T22:32:14.850Z
FALANDO SOBRE BANCOS, CREDIÁRIO BANCO DO BRASIL - COMO USAR O CREDIÁRIO BANCO DO BRASIL NA GETNET ( MOSTREI NA PRÁTICA ),2021-04-12T16:29:17.064Z
iBANK On, #BB COMO TRANSFERIR SEU LIMITE DE CDC PRO CARTAO DE CREDITO DO NO APP DO BANCO DO BRASIL,2021-04-12T16:26:19.658Z
FALANDO SOBRE BANCOS, BANCO DO BRASIL CREDIÁRIO - SAIBA COMO USAR O SEU LIMITE // ASSISTA \\,2021-04-12T16:21:38.500Z
Anny Notícias, LIMITE DISPONÍVEL PARA CREDIÁRIO BANCO DO BRASIL -BB,2021-04-12T16:18:10.240Z
Investcard+, BB CREDIARIO POR QUE HÁ  TANTA DIFICULDADE PARA USAR ESSA LINHA DE CREDITO DO BANCO DO BRASIL?,2021-04-12T16:17:08.851Z
Prochan, PODEMOS DIRIGIR O TREM DO GTA 5!?,2021-04-12T00:48:07.195Z
JeRsEyReBoX, UM NOVO DESAFIO!!! X CHALLENGE - Mega Man X Legacy Collection PTBR,2021-04-12T00:46:22.027Z
Diário do Comércio, Pensão alimentícia: 20 coisas que você precisa saber (Parte 1),2021-04-11T19:22:52.466Z
JeRsEyReBoX, UM NOVO DESAFIO!!! X CHALLENGE - Mega Man X Legacy Collection PTBR,2021-04-11T00:53:04.322Z
Prochan, PODEMOS DIRIGIR O TREM DO GTA 5!?,2021-04-11T00:52:25.513Z
Cortes Podpah [OFICIAL], NÃO EXISTE GUINA E RACIONAIS NA MESMA FRASE !,2021-04-10T18:03:20.665Z
Pipocando, 6 PERSONAGENS ASSUSTADORES que NÃO SÃO de TERROR! 👻 🚫,2021-04-10T17:56:36.386Z
Lucas Retondo, 5 dicas para melhorar a sua automotivação e liderança,2021-04-09T22:20:44.652Z
eXcript," Curso de Python - Aula 43 - Lista, Pilha, Array, Set - eXcript",2021-04-09T22:17:02.672Z
Programação Dinâmica, Criando AMBIENTES VIRTUAIS para PYTHON,2021-04-09T21:51:53.850Z
Fabio Ruicci, Ambiente Virtual / Virtual Environment (Python) - O que é? Pra que serve? Com exemplos,2021-04-09T21:48:01.567Z
Joao Rubens Marchete Filho, Git Branches - O que são? Como funcionam?,2021-04-09T21:39:34.698Z
Curso em Vídeo, Git Branches de forma fácil e com exemplo - Curso de Git e GitHub,2021-04-09T21:22:25.341Z
Canal TI, O que é MVC? Aprenda MVC de MANEIRA FÁCIL,2021-04-09T15:01:23.150Z
Código Fonte TV, MVC // Dicionário do Programador,2021-04-09T14:59:10.643Z
Bóson Treinamentos, O que é Programação Orientada a Objetos - Conceitos Básicos de POO,2021-04-09T13:20:20.123Z
Curso em Vídeo, Curso Python #15 - Interrompendo repetições while,2021-04-09T12:21:37.854Z
Rede TVT," Lula: ""montei quadrilha para tirar 36 milhões da miséria""",2021-04-09T01:01:36.031Z
Brasil Paralelo, 1964 - O Brasil entre armas e livros (FILME COMPLETO),2021-04-09T00:32:08.933Z
Dev Aprender, Python Classes e Métodos - Em Menos de 10 Minutos [FÁCIL],2021-04-08T23:44:58.300Z
Solyd Offensive Security, Aula 13 - API Lista de Filmes - Python Básico Solyd,2021-04-08T23:26:28.222Z
Curso em Vídeo, Curso Python #15 - Interrompendo repetições while,2021-04-08T19:13:17.022Z
Cursos Kane Chan, Estrutura de Repetição While em Python,2021-04-08T19:05:15.804Z
Curso em Vídeo, Curso Python #014 - Estrutura de repetição while,2021-04-08T18:32:17.411Z
Solyd Offensive Security, Aula 13 - API Lista de Filmes - Python Básico Solyd,2021-04-07T16:22:08.212Z
Curso em Vídeo, Git Branches de forma fácil e com exemplo - Curso de Git e GitHub,2021-04-07T12:13:34.631Z
Programação Dinâmica, RASPAGEM DE DADOS com Python É ILEGAL? Como saber se é permitido extrair dados de um site,2021-04-07T11:50:58.642Z
Meteoro Brasil, CIRO GOMES SUGERE QUE LULA CONCORRA COMO VICE,2021-04-07T00:48:08.295Z
Meteoro Brasil, EMOJI DE CHORO SE TORNA O MAIS USADO DO MUNDO,2021-04-05T03:31:48.724Z
Meteoro Brasil, A HISTÓRIA DO DOMINGÃO DO FAUSTÃO,2021-04-05T03:17:29.428Z
Meteoro Brasil," LIBERADAS AS AGLOMERAÇÕES EM IGREJAS, MALAFAIA COMEMORA",2021-04-05T03:05:08.200Z
Meteoro Brasil," FAKE NEWS SOBRE MARIELLE COMEÇARAM NO INSTANTE DO ASSASSINATO, DIZ FREIXO",2021-04-05T02:51:12.612Z
Metaforando, Gamer Assassinada: Um caso de Psicopatia? (Casos de Linguagem Corporal - Metaforando).,2021-04-05T01:46:09.208Z
Metaforando, Caso Henry: 3 Formas de Detectar Mentiras (Linguagem Corporal - Metaforando),2021-04-05T00:57:22.572Z
Botas Vento, Por quê calçados descolam? Motivo 1- HIDRÓLISE,2021-04-04T22:47:14.286Z
Falando Grego, Quando usar cola PVC ou cola de SAPATEIRO  [COLA FORTE OU PVC],2021-04-04T22:41:23.427Z
fabricando calçados, Curso de Rasteirinhas 2021 - Com Pouco Dinheiro - KIT ECONÔMICO.,2021-04-04T22:39:55.872Z
fabricando calçados, Como colar o solado de tênis para não descolar com facilidade,2021-04-04T22:39:25.299Z
Adilson vídeos, Cola pra   colar seu tênis  PRA NUNCA MAIS DESCOLAR,2021-04-04T22:38:49.573Z
fabricando calçados, Cola Pvc No Tênis,2021-04-04T22:35:09.932Z
Space Rails, Como funciona uma requisição HTTP?,2021-04-04T22:28:19.858Z
Solyd Offensive Security, Aula 13 - API Lista de Filmes - Python Básico Solyd,2021-04-04T21:17:57.584Z
Filipe Deschamps, Como Fazer Uma API (o jeito mais fácil e moderno que eu já vi),2021-04-04T21:12:50.297Z
Dev Aprender, Python Classes e Métodos - Em Menos de 10 Minutos [FÁCIL],2021-04-04T21:11:18.617Z
Curso em Vídeo, Mundo 02 - Curso de Python - Dicas e Regras,2021-04-04T21:09:13.396Z
Curso em Vídeo, Curso Python #23 - Tratamento de Erros e Exceções,2021-04-04T20:34:35.531Z
Solyd Offensive Security, Aula 12 - Requisições Web - Python Básico Solyd,2021-04-04T13:17:10.874Z
Victor Lima - Guia do Programador, Arquitetura MVC - Aprenda Django #02,2021-04-04T12:25:54.456Z
DevMedia, Curso de RESTful: O que é RESTful? Diferença entre REST e RESTful,2021-04-04T12:20:23.616Z
Otávio Miranda, Classes - Python Orientado a Objetos - Aula 35,2021-04-03T21:07:26.703Z
Flow Podcast e PodPah - Cortes, FROID FOI ABDUZIDO POR ALIENS AOS 7 ANOS,2021-04-02T02:00:14.653Z
Meus 2 Centavos, LIGA DA JUSTIÇA DE ZACK SNYDER - SPOILERS!,2021-04-02T01:54:41.379Z
Flow Compilações, DISCUSSÕES F0D4S DO FLOW #05,2021-04-02T01:54:18.826Z
Flow Compilações, DISCUSSÕES F0D4S DO FLOW #07,2021-04-02T01:41:16.958Z
Meteoro Brasil," NO ANIVERSÁRIO DO GOLPE DE 1964, IMPRENSA TOMA JEITO",2021-04-02T01:26:07.701Z
Flow Compilações, NEG4O DA BL PERDE A PACIÊNCIA COM MONARK | MELHORES MOMENTOS,2021-04-02T01:18:43.092Z
Cortes Podcast, NEGÃO DA BL FALA SOBRE AMIGO QUE ROUBOU SEU DINHEIRO | Cortes Podcast,2021-04-02T01:00:19.003Z
Flashes do Flow, TOGURO E MONARK DISCUTEM SOBRE MAC#NHA E O CLIMA ESQUENTA | FLASHES DO FLOW,2021-04-02T00:46:15.199Z
Cortes Podpah [OFICIAL], DA CUNHA FOI FALSO?,2021-04-02T00:36:45.233Z
Cortes Podpah [OFICIAL], DA CUNHA E FABIL DEBATEM AO VIVO,2021-04-01T22:21:15.332Z
REC Podcasts, Shows de FROID e DJONGA [ENXUGA GELO],2021-04-01T22:20:02.683Z
REC Podcasts," MURILO COUTO E FROID, MELHORES MOMENTOS [ENXUGA GELO PODCAST]",2021-04-01T22:09:49.993Z
Bóson Treinamentos, O que é Levantamento de Requisitos - Tópicos de Engenharia de Software,2021-04-01T18:46:28.921Z
DevMedia, Curso Levantamento de Requisitos: Exemplo prático de entrevista | Aula demonsrativa,2021-04-01T18:46:00.412Z
DevMedia, Qual a sua maior dificuldade na hora de escrever seu código? | #DevMediaResponde,2021-04-01T18:45:42.843Z
Programação Dinâmica, Busca Linear em Listas | Como encontrar Elemento em uma Lista com Python | Estruturas de Dados #2,2021-04-01T18:30:17.629Z
Meteoro Brasil," CRIADOR DO TERMO ""PETRALHA"" ENTREVISTA LULA",2021-04-01T17:31:04.588Z
William Abreu, Estrutura de Repetição - Somatório simples,2021-04-01T17:30:41.936Z
Charles Franca, Entendendo o Json,2021-04-01T01:09:26.516Z
Tito Spadini, Python - Importando colunas específicas de um CSV,2021-04-01T00:57:07.459Z
Programação Dinâmica, Como manipular um DataFrame e EXPORTAR para CSV? | Análise de dados #9,2021-04-01T00:52:00.599Z
Zurubabel, Curso de Pandas - Python (Aula 0.1) - Abrindo arquivos em CSV,2021-04-01T00:51:07.459Z
Alura Cursos Online, Como funcionam os navegadores Web? #HipstersPontoTube,2021-04-01T00:41:22.484Z
Curso em Vídeo, Curso Python #08 - Utilizando Módulos,2021-03-31T23:37:52.735Z
Meteoro Brasil, SOCORRO! BRASIL IMPLORA POR AJUDA INTERNACIONAL,2021-03-31T23:11:46.031Z
NeuroVox, Em Busca de Nós Mesmos | PEDRO CALABREZ | NeuroVox 027,2021-03-31T00:19:51.367Z
CFBCursos, JSON em PYTHON - Curso de Python #36,2021-03-30T23:45:18.505Z
Meio," Ernesto Araújo caiu, mas Bolsonaro quer guerra I Ponto de Partida",2021-03-30T22:23:08.024Z
Jornalismo TV Cultura," ""Presidente caminha para um golpe de estado"", diz Marco Antonio Villa",2021-03-30T22:18:47.878Z
Henry Bugalho, BOLSONARO VAI FECHAR O MEU CANAL?!!!,2021-03-30T22:16:28.177Z
Boris Casoy, Golpe? Reflexões sobre a crise | Boris Casoy | 30/03/2021,2021-03-30T22:15:35.325Z
Meteoro Brasil, COMO OS HERDEIROS ESTÃO MATANDO O CAPITALISMO,2021-03-30T22:14:39.368Z
Meteoro Brasil, BOLSONARO ESTÁ PREPARANDO O GOLPE?,2021-03-30T22:01:58.153Z
Filipe Deschamps, Descobri Como Consertar o Meu Maior Problema,2021-03-30T18:07:52.661Z
Flow Podcast e PodPah - Cortes, DJONGA COMPLETAMENTE BÊBADO NO PODPAH,2021-03-30T18:07:12.758Z
Flow Compilações, PODPAH COM DJONGA SAIU DO CONTROLE | MELHORES MOMENTOS,2021-03-30T17:55:19.768Z
HAIKAISS, Haikaiss - Sem Graça (Prod. Tuchê),2021-03-30T17:53:49.800Z
adsense, https://www.youtube.com/watch?v=W1HJ8gOzSdI,2021-03-30T17:49:05.540Z
Programação Dinâmica, Consumindo dados da API do YOUTUBE com Python | Python na Prática #11,2021-03-30T14:34:02.240Z
TEDx Talks, Para Início de Conversa | Carolina Nalon | TEDxPedradoPenedo,2021-03-29T16:19:18.397Z
Alura Cursos Online, Como funcionam os navegadores Web? #HipstersPontoTube,2021-03-29T14:28:17.375Z
Uniday Studio, Refatoração: PYTHON com o PyCharm,2021-03-29T14:21:32.784Z
Programação Dinâmica, Como abrir(importar) um dataset em Python? | Análise de dados #2,2021-03-29T14:12:08.637Z
Bóson Treinamentos, 31 - Curso de Python - Módulos - Criando e importando,2021-03-29T14:11:43.805Z
Bóson Treinamentos, 6 - Importação de Módulos em Python,2021-03-29T11:48:15.535Z
Aprenda Código, Parte 5 - Como criar um módulo de Python 3 e importar em outro arquivo,2021-03-29T11:43:52.454Z
Wilson Simoninha, Wilson Simonal - País Tropical - Ao Vivo,2021-03-29T01:16:13.298Z
Filipe Deschamps, SOLID fica FÁCIL com Essas Ilustrações,2021-03-28T11:24:47.657Z
TEDx Talks, The Power of Mindfulness: What You Practice Grows Stronger | Shauna Shapiro | TEDxWashingtonSquare,2021-03-27T15:01:21.905Z
DevPleno, Dicas para seu Profile README.md do Github,2021-03-27T11:13:15.352Z
Carlos Levir, COMO ORGANIZAR SEU GITHUB | DEVFOLIO #01,2021-03-27T11:12:44.030Z
TEDx Talks, Para Início de Conversa | Carolina Nalon | TEDxPedradoPenedo,2021-03-26T18:41:16.763Z
Meteoro Brasil, DEVEMOS CHAMAR OS BOLSONARISTAS DE GADO? CIRO GOMES RESPONDE,2021-03-25T23:28:08.262Z
Meteoro Brasil, BOLSONARO COLOCA PF NA COLA DE CIRO GOMES,2021-03-25T23:14:54.025Z
Curso em Vídeo, Exercício Python #085 - Listas com pares e ímpares,2021-03-25T18:43:46.704Z
Ignorância Zero," Aulas Python - 062 - POO IV: Herança, Super e Polimorfismo",2021-03-25T16:02:46.305Z
Marcos Castro, Python - Estrutura de Dados Fila,2021-03-25T15:43:51.404Z
Otávio Miranda, Filas em Python (Estrutura de dados - Queue),2021-03-25T15:32:51.287Z
Canal TI, O que é MVC? Aprenda MVC de MANEIRA FÁCIL,2021-03-25T11:24:39.326Z
Filipe Ret, Filipe Ret - WAR,2021-03-25T10:19:52.456Z
Joseph Solomon, most beautiful/so in love x maverick city,2021-03-25T10:19:35.305Z
Joseph Solomon, ex factor x lauryn hill,2021-03-25T10:18:40.043Z
Canal TI, O que é MVC? Aprenda MVC de MANEIRA FÁCIL,2021-03-24T23:15:09.111Z
Victor Lima - Guia do Programador, Arquitetura MVC - Aprenda Django #02,2021-03-24T23:00:08.736Z
BBC Earth, Iguana vs Snakes | Planet Earth II,2021-03-24T18:57:01.995Z
Trabalho Virtual, Como Trabalhar Home Office Para Microsoft e Intel (APLICAÇÃO DIRECTLY),2021-03-24T14:51:31.918Z
Fernando de Paula - Trabalho Informal, Descobri uma forma de fazer a DIRECTLY chamar [CONFIRA NESTE VÍDEO MINHA TEORIA],2021-03-24T14:37:32.238Z
Siméia Avellar | Negócios Digitais, Como Anunciar no Google Ads PASSO A PASSO Para Iniciantes 2020 Tutorial Completo | Google Adwords,2021-03-24T14:15:41.565Z
Estampa Web, Quanto cobrar pelo design de uma estampa?,2021-03-24T14:03:15.211Z
Instituto Montanari, 24/03 AUXÍLIO EMERGENCIAL 2021 BOLSA FAMÍLIA PAULO GUEDES FALA SOBRE PLANOS | 13º APOSENTADOS,2021-03-24T12:58:49.016Z
Fature Com Naldo," PaidViewPoint Receba Quase R$100,00 no Paypal Com Perguntas Rápidas- Fature Com Naldo",2021-03-24T11:59:38.929Z
Fature Com Naldo, Você Opina Pesquisa É Confiável? GanheR$65 no Paypal. Opinião Sincera- Fature Com Naldo,2021-03-24T11:51:55.444Z
Siméia Avellar | Negócios Digitais," COMO TRABALHAR NA INTERNET PARA NETFLIX, MICROSOFT,  LINKEDIN E GANHAR DINHEIRO EM DÓLAR HOME OFFICE",2021-03-24T11:51:48.101Z
Thamires Moura, Home Office- Ganhe Dinheiro Enviando E-mails 2021,2021-03-24T11:45:53.711Z
Romário Bruno - Canal Conquistas Digitais, Ganhe R$100 Por Dia Trabalhando em Casa Para NETFLIX (HOME OFFICE) Suporte ao Cliente,2021-03-24T11:45:21.705Z
Weder Silva, ESFIRRA ÁRABE SALGADO BARATO VENDE COMO ÁGUA,2021-03-24T11:44:54.122Z
Weder Silva," Joelhos de Presunto e Queijo, Já Ganhei Muito Dinheiro Com Esse Salgado!!!",2021-03-24T04:17:04.646Z
Dika da Naka, ENROLADO DE PRESUNTO E QUEIJO PERFEITO - MASSA PARA SALGADO ASSADO - LANCHE FÁCIL OU FAÇA E VENDA,2021-03-24T04:16:02.038Z
Romário Bruno - Canal Conquistas Digitais," Ganhe $50,00 Por Hora Gravando Frases Para Grandes Empresas (HOME OFFICE) Neevo Como Ganhar Dinheiro",2021-03-24T03:39:16.537Z
Cortes Podpah [OFICIAL], MC KEVIN JÁ TRAFIC0U MESMO?,2021-03-24T03:35:03.176Z
Montar um Negócio, 7 IDEIAS DE COMBOS DE LANCHES PARA VENDER,2021-03-24T02:48:32.423Z
Montar um Negócio, 12 COISAS PARA VENDER A 1 REAL,2021-03-24T02:46:43.502Z
Escola Atomy By Anizio Filho , IFOOD 2021: QUAL  PRIMEIRO PASSO PRA VENDER NO IFOOD DELIVERY,2021-03-24T02:41:33.388Z
"E agora, Bárbara?", Divórcio: Ex-esposa tem direito a Pensão Alimentícia? #EagoraBárbara,2021-03-24T01:53:53.311Z
Lilian Keffilin," Se você mora junto e não se casou, assista a esse vídeo. WebSérie União Estável #02",2021-03-24T01:49:25.785Z
ALEX FARINELI, Pensão por morte | O Cônjuge,2021-03-24T01:45:24.053Z
"E agora, Bárbara?"," Depois do divórcio, o ex-marido tem obrigação de pagar as contas da ex-mulher?",2021-03-24T01:39:57.242Z
Gediel Araujo, O homem é obrigado a pagar pensão para a ex mulher?,2021-03-24T01:38:18.338Z
Curso em Vídeo, Curso Python #17 - Listas (Parte 2),2021-03-24T01:29:50.744Z
Curso em Vídeo, Curso Python #01 - Seja um Programador,2021-03-24T01:26:50.359Z
Curso em Vídeo, Usando Google Fonts - @Curso em Vídeo HTML5 e CSS3,2021-03-24T01:26:17.374Z
adsense, iPhone 12 Pro — Faça filmes de cinema,2021-03-24T01:21:42.214Z
William Abreu, Estrutura de Repetição - Somatório simples,2021-03-24T01:21:34.946Z
Curso em Vídeo, Curso Python #17 - Listas (Parte 1),2021-03-23T19:08:41.344Z
Programação Dinâmica, Pilhas em Python | Estruturas de Dados #7,2021-03-23T13:53:52.135Z
KillerGP, LIBEREI O SETOR 7! ( com facecam ) | Last Day on Earth,2021-03-23T03:05:34.335Z
Marcos Castro, Curso Python 300 - Aula 38 - Herança - Implementação,2021-03-22T18:35:41.409Z
LUNNA 100 Popô, TIRANDO O APARELHO SOZINHA,2021-03-22T15:29:07.249Z
Curso em Vídeo, Curso Python #014 - Estrutura de repetição while,2021-03-22T14:29:00.209Z
Curso em Vídeo, Curso Python #22 - Módulos e Pacotes,2021-03-22T14:28:05.416Z
Curso em Vídeo, Curso Python #21 - Funções (Parte 2),2021-03-22T14:27:58.445Z
Curso em Vídeo, Curso Python #20 - Funções (Parte 1),2021-03-22T14:25:56.217Z
Programação Dinâmica, O que são Classes e Como Criar Novos Tipos de Dados em Python | Orientação a Objetos #2,2021-03-22T13:02:42.955Z
Programação Dinâmica," O que é um Objeto, Atributo, Método e Mensagem | Orientação a Objetos #1",2021-03-22T12:53:55.385Z
nk music, NK Music x Mariussax - Driftin' [Full LoFi BeatTape],2021-03-20T22:25:45.746Z
NTOBtv, NTOBTV -  Michael and Adrian Learning Basketball,2021-03-20T21:06:24.015Z
nk music," [FREE] J. Cole x Isaiah Rashad x Kendrick Lamar Type Beat | ""Triton""",2021-03-20T14:40:24.107Z
Balance Cooper," JOEY BADA$$ X BOOM BAP TYPE BEAT ""TEATIME""",2021-03-20T14:36:17.629Z
Balance Cooper," (FREE) SCHOOLBOY Q X A$AP ROCKY TYPE BEAT ""SOUVENIR""",2021-03-20T14:32:35.561Z
Balance Cooper," (FREE) KENDRICK LAMAR X A$AP ROCKY TYPE BEAT ""SWEATER WEATHER""",2021-03-20T14:29:03.501Z
Balance Cooper," (FREE) KID CUDI TYPE BEAT ""HOURS""",2021-03-20T14:26:04.536Z
Balance Cooper," (FREE) BRENT FAIYAZ TYPE BEAT ""CHANGE OF SEASON""",2021-03-20T14:22:21.860Z
Real Kayblack, Kayblack - Vivências (Prod. Wall Hein),2021-03-20T14:20:28.401Z
Hash Produções, Jovemdex - Tapa ;) (Vídeo Oficial),2021-03-20T14:20:20.305Z
Sidoka *," Sidoka "" VIDRO "" (Prod by. ÉmiKá) [Shot by Bzk]",2021-03-20T14:19:34.009Z
SZAVEVO, SZA - The Weekend (Audio),2021-03-20T14:14:42.965Z
Fkj, Fkj & Masego - Tadow,2021-03-20T14:12:49.694Z
Jean Tassy, Jean Tassy - Diz pra Mim (Prod. Iuri Rio Branco),2021-03-20T14:12:47.671Z
RnB Traduções, Daniel Caesar - Best Part (feat. H.E.R) [LEGENDA/TRADUÇÃO],2021-03-20T14:12:44.780Z
KaEsse  , Cês Fala Demais - KaEsse | Prod. Toma Esse Beat  (Video Official ),2021-03-20T03:54:41.541Z
nat," (FREE) Joey Badass Type Beat - ""IT AIN'T EASY""",2021-03-20T01:16:10.001Z
bvtman," Kendrick Lamar x ScHoolboy Q x   J Cole Type Beat Type Beat ""Numb"" || [NEW 2019]",2021-03-20T01:15:36.621Z
Balance Cooper," JOEY BADA$$ X BOOM BAP TYPE BEAT ""TEATIME""",2021-03-20T01:14:44.607Z
Balance Cooper," (FREE) SCHOOLBOY Q X A$AP ROCKY TYPE BEAT ""SOUVENIR""",2021-03-20T01:11:02.938Z
Balance Cooper," (FREE) KENDRICK LAMAR X A$AP ROCKY TYPE BEAT ""SWEATER WEATHER""",2021-03-20T01:08:01.344Z
Balance Cooper," (FREE) KID CUDI TYPE BEAT ""HOURS""",2021-03-20T01:04:28.958Z
Black Alien, Carta Pra Amy (Clipe Oficial),2021-03-20T00:59:03.344Z
Emicida," Emicida - Principia part. Pastor Henrique Vieira, Fabiana Cozza, Pastoras do Rosário",2021-03-20T00:53:06.456Z
Beyoncé - Topic, Pretty Hurts,2021-03-20T00:52:17.391Z
Jean Tassy, Jean Tassy - Diz pra Mim (Prod. Iuri Rio Branco),2021-03-20T00:48:34.167Z
Giveon - Topic, Heartbreak Anniversary,2021-03-20T00:48:02.395Z
Official Arctic Monkeys, Arctic Monkeys - Do I Wanna Know? (Official Video),2021-03-20T00:43:35.810Z
KhalidVEVO, Khalid - Location (Official Video),2021-03-20T00:41:52.295Z
RnB Traduções, Daniel Caesar - Best Part (feat. H.E.R) [LEGENDA/TRADUÇÃO],2021-03-20T00:38:25.553Z
Childish Gambino - Topic, Sober,2021-03-20T00:38:21.421Z
Gotye - Topic, Somebody That I Used To Know,2021-03-20T00:38:12.286Z
adsense, https://www.youtube.com/watch?v=BzusSr9xuZc,2021-03-20T00:34:09.748Z
Fkj, Fkj & Masego - Tadow,2021-03-20T00:34:06.649Z
ChildishGambinoVEVO, Childish Gambino - Feels Like Summer,2021-03-20T00:33:55.055Z
Canal PeeWee, Liga da Justiça de Zack Snyder (Snyder Cut) | Opinião SEM Spoilers,2021-03-20T00:23:52.476Z
Caue Moura, NÃO PODE CHAMAR O PRESIDENTE DE QUE??? 🤔🤔🤔,2021-03-20T00:21:49.152Z
