Canal,Nome vídeo,Data
Nocivo Shomon," R.U.A  ( Desordem) Nocivo Shomon, Gigante No Mic, Xamã - Prod. Matilha Music",2021-07-01T17:00:26.031Z
DonLMusic," Don L - Morra Bem, Viva Rápido",2021-07-01T16:55:54.495Z
Alaska, Froid - Kyoto,2021-07-01T16:52:28.582Z
Rap Box, Froid part. Cynthia Luz  - Bicho de 7 Cabeças/A Culpa é das Igrejas [Ep. 123 ] [ Prod. Leo Casa 1 ],2021-07-01T16:47:17.467Z
Fkj, Fkj & Masego - Tadow,2021-07-01T16:47:06.005Z
RnB Traduções, Daniel Caesar - Best Part (feat. H.E.R) [LEGENDA/TRADUÇÃO],2021-07-01T16:46:52.797Z
Daft Punk, Daft Punk - Something About Us (Official Video),2021-07-01T16:43:11.153Z
fosterthepeopleVEVO, Foster The People - Imagination (Official Audio),2021-07-01T16:42:55.702Z
tameimpalaVEVO, Tame Impala - The Less I Know the Better (Official Audio),2021-07-01T16:42:39.663Z
ChildishGambinoVEVO, Childish Gambino - Redbone (Official Audio),2021-07-01T16:38:19.680Z
ChildishGambinoVEVO, Childish Gambino - Feels Like Summer,2021-07-01T16:33:45.873Z
EPIK BEATS," 1 Hour Of Beats [FREE] kendrick lamar, j cole, jid, kenny mason, smino type beats 2021",2021-07-01T16:31:59.111Z
Su Alves, COMO CONSEGUIR CRÉDITO NO NUBANK,2021-07-01T14:43:40.657Z
Joselito Macedo, COMO AUMENTAR O LIMITE DO NUBANK EM 2021 - FÓRMULA INFALÍVEL - PASSO A PASSO,2021-07-01T14:41:55.505Z
Luis Rafael Oficial," LIMITE DO CARTÃO DE CRÉDITO NUBANK 0,00 ? ? ? ENTENDA COMO FUNCIONA !",2021-07-01T14:39:36.304Z
• Podcast Cortes • [LEGENDADO], JAMIE FOXX FALA SOBRE TRABALHAR COM QUENTIN TARANTINO | LEGENDADO,2021-07-01T14:38:35.785Z
• Podcast Cortes • [LEGENDADO], JOHNNY DEPP EXPLICA PORQUE NÃO ASSISTE AOS SEUS FILMES | LEGENDADO,2021-07-01T14:38:29.902Z
Vamos Analisar, Gráfico de Dois Eixos no Tableau com Ligia Galvão,2021-07-01T12:21:28.943Z
Vamos Analisar, Formas Personalizadas no Tableau,2021-07-01T12:09:46.830Z
Vamos Analisar, Longitude e Latitude no Tableau,2021-07-01T11:38:55.345Z
Vamos Analisar, Dica de ferramenta no Tableau com Ligia Galvão,2021-07-01T10:55:04.343Z
Geração Analítica, Curso Tableau com Certificado | Download e Preparação de dados #01,2021-07-01T10:50:46.641Z
Flow Podcast Cortes ✔︎, RAEL NO PODPAH FALA MANDA A FITA PRA NOVA GERAÇÃO DO RAP E FUNK | CORTES PODPAH,2021-07-01T00:25:03.302Z
O Primo Rico, MELHOR APLICATIVO DE DELIVERY PARA PEQUENOS NEGÓCIOS? | Primo Startups,2021-07-01T00:24:39.606Z
Netflix Brasil, Awake | Trailer oficial | Netflix,2021-07-01T00:22:13.373Z
Netflix España, Xtremo | Tráiler Oficial | Netflix,2021-07-01T00:21:57.567Z
Einzelgänger, How to Stop Taking Things So Personally,2021-06-30T19:21:48.711Z
Samhu," Free Sad Type Beat - ""Back Stab"" | Rap Instrumental 2020 |",2021-06-30T15:17:29.370Z
Gian Beat, Baby Love - Beat Trap Hip Romántico - Instrumental GianBeat,2021-06-30T15:17:12.851Z
Prod Camelo, [FREE] Sidoka x Lil Skies Type Beat / Free 'LoveBit' Trap Beats 2020 - Rap Instrumental @Prod.Camelo,2021-06-30T15:14:56.119Z
Buneツ," [FREE] Tz da coronel x Kyan x Abbot - Type beat - ""The box 🔥💸"" | Prod. Bune",2021-06-30T15:14:09.343Z
ESKRY," [SOLD] SKI MASK THE SLUMP GOD TYPE BEAT ""DRUM"" (prod. ESKRY)",2021-06-30T15:06:50.163Z
Beatz Era," (FREE) Travis Scott  - ""Paris"" | SUPREME I Free Type Beat I Trap Beat Instrumental",2021-06-30T15:02:56.650Z
Khronos Beats," ""More Smoke"" - Rap Freestyle Type Beat | Underground Hip-Hop Boom Bap Type Beat (By KhronosBeats)",2021-06-30T15:02:46.024Z
nk music," [FREE] J. Cole x Isaiah Rashad x Kendrick Lamar Type Beat | ""Triton""",2021-06-30T15:02:44.259Z
Antidote Beats," ""1991"" Old School Boom Bap Type Beat | Underground Hip Hop Rap Instrumental | Antidote Beats",2021-06-30T15:02:42.641Z
Antidote Beats," ""1997"" Old School Boom Bap Type Beat | Underground Hip Hop Rap Instrumental | Antidote Beats",2021-06-30T15:02:16.985Z
Enxuga Gelo PodCast - FROID, CONVIDADO DA INDIRETA PRO FROID AO VIVO !! ( CLIMA FICA TENSO ),2021-06-30T14:41:19.028Z
Criolo, Criolo - Fellini,2021-06-30T14:37:43.743Z
Lofi Girl, lofi hip hop radio - beats to relax/study to,2021-06-30T14:08:26.330Z
Meteoro Brasil, FAUSTO JUNIOR NA CPI: UM RESUMO,2021-06-30T04:46:44.346Z
adsense, VOCÊ ESTÁ PRONTO PARA VIVER SUAS VERDADES | Chega de Mentiras | Gillette Brasil,2021-06-30T04:46:20.746Z
Ilha de Barbados, PRODUTO PIRATA É PARA QUEBRAR O SISTEMA com Igor 3k,2021-06-30T04:17:52.696Z
Delegado da Cunha Stories Diários, DELEGADO DA CUNHA FOI  PROIBIDO DE TRABALHAR NA POLÍCIA,2021-06-30T04:02:37.910Z
Luca Martini," BURGUER KING, CRIANÇAS E LGBTQIA+",2021-06-30T03:39:19.083Z
CincoMangos," A PROPAGANDA LGBTQIA+ DO BURGER KING, COM CRIANÇAS (VÍDEO COMPLETO)",2021-06-30T03:34:28.350Z
Burger King BR, Burger King | Como explicar?,2021-06-30T03:34:12.192Z
Canal Hipocritas, BURGER KING USA CRIANÇAS EM COMERCIAL LGBT.,2021-06-30T03:32:33.924Z
Cris Araújo, Burger King usa crianças em comercial LGBT,2021-06-30T03:30:49.455Z
Morning Show, Ludmilla x Sikêra: Propaganda com crianças sobre diversidade gera TRETA,2021-06-30T03:17:53.294Z
Código Fonte TV, Python // Dicionário do Programador,2021-06-30T03:09:17.108Z
Código Fonte TV," Pandas (A Lib ""Delicinha"" para Data Science) // Dicionário do Programador",2021-06-30T00:40:19.962Z
Hekima," ""Data Storytelling - Contando histórias com dados""  - Palestra do Luiz Mendes",2021-06-30T00:26:04.337Z
Elias Marques Fotógrafo, Como desfocar o fundo das fotos usando Photoshop,2021-06-29T17:18:13.470Z
Rafael Ferreira, Como desfocar o fundo no Photoshop,2021-06-29T17:14:23.208Z
Meteoro Brasil," ACUADO POR CPI, BOLSONARO REAGE",2021-06-27T18:27:22.717Z
Meteoro Brasil, POR QUE A AMÉRICA NÃO COLONIZOU A EUROPA,2021-06-27T17:51:38.505Z
HBO Brasil, GREG NEWS | PARE DE SOFRER,2021-06-26T19:34:15.680Z
Rádio BandNews FM," Luiz Megale comenta fala de Bolsonaro sobre Covaxin: ""Papo furado""",2021-06-26T19:25:17.037Z
Meteoro Brasil, X9 DA VACINA SUPERFATURADA NA CPI: UM RESUMO,2021-06-26T19:01:13.172Z
Meteoro Brasil, JUREMA WERNECK & PEDRO HALLAL NA CPI: UM RESUMO,2021-06-26T18:58:31.168Z
Programação Dinâmica, CIENTISTAS DE DADOS podem DEIXAR de EXISTIR? Tendências da área de DADOS com Paulo Vasconcellos,2021-06-26T13:11:05.079Z
adsense, Universitários do Brasiiilll: regozijem com Cartão SX,2021-06-26T13:09:09.151Z
Rádio BandNews FM - Rio de Janeiro, Felipe Moura Brasil: Caso Kathlen - as questões por trás da morte da grávida à bala,2021-06-26T13:04:56.795Z
adsense, Conheça os fatos sobre as vacinas contra a covid-19,2021-06-26T13:03:15.026Z
nk music," [FREE] J. Cole x Isaiah Rashad x Kendrick Lamar Type Beat | ""Triton""",2021-06-25T23:57:19.629Z
DoisT Oficial, Facada Eleitoral - DoisT I Fabio Brazza I Nego Max I Mc Jhony I Rapadura (Prod.RVL$),2021-06-25T23:49:18.602Z
ZUP, Como customizar seu perfil Github com o Ritchie | ⚙️ Ritchie CLI,2021-06-25T23:42:33.119Z
Alura Cursos Online, O que são Git e Github? #HipstersPontoTube,2021-06-25T23:34:40.473Z
adsense, Manhãs de Setembro,2021-06-25T12:23:12.583Z
Flow Compilações, TENTE NÃO RIR COM COMEDIANTES NO FLOW (IMPOSSÍVEL),2021-06-25T12:19:25.116Z
Swift Podcortes, Quais as MELHORES gerações do FELIPE NETO?! (Maurício Meirelles) | Swift Podcortes,2021-06-25T12:14:10.622Z
Swift Podcortes, COMO É ENTREVISTAR FAMOSOS INTERNACIONAIS? (Maurício Meirelles) | Swift Podcasts,2021-06-25T11:55:03.476Z
Cortes Podpah [OFICIAL], QUAVO (DO MIGOS) DEVENDO GRANA PRO FELP 22,2021-06-25T11:45:09.395Z
Flow Podcast Cortes ✔︎, DELACRUZ NO PODPAH FALA SOBRE FROID | CORTES PODPAH,2021-06-25T11:44:25.250Z
adsense, Tanqueray: O Gin Inconfundível,2021-06-25T11:40:51.870Z
Walisson Silva, #11 - Inserindo e Removendo Colunas do DataFrame | Data Science com Python,2021-06-25T01:42:21.156Z
Tito Spadini, Python - Inserindo colunas em DataFrames,2021-06-25T01:35:45.804Z
Walisson Silva, #13 - Agrupando Dados de um DataFrame | Data Science com Python,2021-06-25T01:10:28.698Z
Programe Python, Python PANDAS - Groupby: como agrupar dados,2021-06-25T00:53:52.053Z
PineappleStormTV," Poesia Acústica #11 - Nada Mudou - L7NNON, CHRIS, Ryan SP, Lourena, Xamã, Azzy, Mc Poze, Cynthia Luz",2021-06-24T19:12:25.485Z
Metaforando, Caso Lázaro: Qual o perfil deste Serial Killer? (Análise de Linguagem Corporal - Metaforando),2021-06-24T17:40:58.831Z
Meteoro Brasil, BOLSONARO TEM 15 DIAS PARA PROVAR FRAUDE EM ELEIÇÕES,2021-06-24T17:40:09.185Z
Meteoro Brasil, CIRO GOMES DE ARMADURA MONTADO NUMA ONÇA CUIDA DE TATU E CARCARÁ,2021-06-24T17:20:31.643Z
Luiz Victor," Resenha do livro ""Storytelling com Dados"" - Cole Knaflic",2021-06-24T17:20:27.064Z
Data Arte," 31 dicas sobre Visualização de Dados -  Baseado no Livro ""StoryTelling com Dados""",2021-06-24T16:44:30.180Z
Endeavor Brasil, e-Talks | Como fazer  apresentações inesquecíveis usando o Storytelling,2021-06-24T14:00:22.851Z
O cara das Histórias Fantásticas, Como criar conteúdo com História (Storytelling) no Instagram | Aula Completa,2021-06-24T13:59:47.547Z
Fantástica Fábrica Criativa, Como criar um conteúdo para prender a atenção das pessoas,2021-06-24T13:59:18.299Z
Base dos Dados, Workshop: Aplicações em Python,2021-06-24T13:33:23.284Z
Fantástica Fábrica Criativa, Dicas de Storytelling: Uma história em 3 PASSOS!,2021-06-24T13:24:22.578Z
Didática Tech, Como criar gráficos em Python com Matplotlib (Python para machine learning - Aula 21),2021-06-23T20:00:51.516Z
CANAL SANDECO, DATA SCIENCE JUPYTER#03 INSERINDO TEXTOS COM MARKDOWN,2021-06-23T19:59:14.280Z
Programação Dinâmica, Como usar o Google COLAB para ANALISAR DADOS? | Handshake #08,2021-06-23T16:08:59.483Z
Didática Tech, Manipulando colunas em um dataframe pandas (Python para Machine Learning - Aula 16),2021-06-23T15:58:01.077Z
Programação Dinâmica, CONVERTENDO uma coluna de um DataFrame do Pandas | Dica de Pandas #1,2021-06-23T15:55:10.061Z
Base dos Dados, Workshop: Aplicações em Python,2021-06-22T22:58:51.555Z
Kombi Moments, Os Últimos Desejos da Kombi - Volkswagen,2021-06-22T19:27:32.057Z
Hashtag Programação, Automatize Qualquer Sistema ou Programa com Python (RPA),2021-06-22T00:03:11.245Z
Alexandre Lopes, Explorando Dados Com Python e Pandas - Video 1 Teoria,2021-06-21T21:51:41.311Z
Programação Dinâmica, Explorando DataFrame com Pandas Profiling no Google Colab | Dica de Pandas #12,2021-06-21T21:50:48.779Z
Base dos Dados, Workshop: Aplicações em Python,2021-06-21T21:41:00.837Z
Stack, Live #11: Análise Exploratória de Dados (Passo a Passo com Python),2021-06-21T16:24:15.352Z
Meteoro Brasil, O CHURRASCO DO FIM DO MUNDO,2021-06-21T00:18:57.942Z
Meteoro Brasil," A ""CIÊNCIA"" POR TRÁS DO TRATECOV",2021-06-20T23:44:07.590Z
Base dos Dados, Workshop: Aplicações em Python,2021-06-20T22:03:08.488Z
Base dos Dados, Workshop: Aplicações em Python,2021-06-19T23:48:21.775Z
Emicida," Emicida, Rael, Kamau, Coruja BC1, Drik Barbosa e Fióti - Avuá",2021-06-17T20:46:17.691Z
3030 Oficial, 3030 - Febre da Mudança (part. Emicida) (Clipe Oficial),2021-06-17T20:44:01.230Z
Emicida - Topic, Salve Black (Estilo Livre),2021-06-17T20:43:46.557Z
Emicida - Topic, Sodade,2021-06-17T20:43:24.526Z
Emicida - Topic, Casa,2021-06-17T20:43:07.022Z
Emicida - Topic, 8,2021-06-17T20:42:54.484Z
Emicida - Topic, Mãe,2021-06-17T20:42:49.991Z
EmicidaOficialVEVO, Emicida - Madagascar (Pseudo Vídeo),2021-06-17T20:41:09.626Z
EmicidaOficialVEVO, Emicida - Trabalhadores do Brasil (Pseudo Vídeo),2021-06-17T20:41:00.133Z
Emicida, Emicida & Drik Barbosa - Sementes,2021-06-17T20:40:45.413Z
Emicida, Emicida - É tudo pra ontem part. Gilberto Gil,2021-06-17T20:39:24.150Z
Emicida, Emicida - Quem tem um amigo (tem tudo) part. TSPO & Zeca Pagodinho,2021-06-17T20:39:15.584Z
Emicida, Emicida - Paisagem (Áudio oficial),2021-06-17T20:39:14.608Z
Emicida," Emicida - Cananéia, Iguape e Ilha Comprida (Áudio oficial)",2021-06-17T20:39:13.011Z
Emicida, Emicida - Libre part. Ibeyi (Áudio Oficial),2021-06-17T20:38:20.969Z
Emicida, Emicida - Pequenas Alegrias da Vida Adulta part. Thiago Ventura (Áudio Oficial),2021-06-17T20:37:49.738Z
Emicida, Emicida - Ordem Natural das Coisas part. Mc Tha (Áudio oficial),2021-06-17T20:37:36.698Z
Enxuga gelo Fora de contexto, FROID FALA QUE NÃO TEM PAI E DJONGA RI...(EXPOSED)😮,2021-06-17T19:42:48.897Z
Programação Dinâmica, CONVERTENDO uma coluna de um DataFrame do Pandas | Dica de Pandas #1,2021-06-17T15:56:29.809Z
Grupo Teixeira, Abono do PIS 2021 2022,2021-06-17T14:37:25.242Z
Instituto Montanari, 3 PARCELA CALENDÁRIO AUXÍLIO EMERGENCIAL 2021 BOLSA FAMÍLIA PAGAMENTOS ANTECIPADOS!,2021-06-17T14:31:35.787Z
GuuhDesenhos, COMO DESENHAR O GOKU SSJ BLUE,2021-06-16T15:46:59.951Z
GuuhDesenhos, COMO DESENHAR O KAKASHI,2021-06-16T15:44:32.908Z
Hashtag Programação, Automatize Qualquer Sistema ou Programa com Python (RPA),2021-06-16T13:36:00.630Z
Hashtag Programação, Automatize Qualquer Sistema ou Programa com Python (RPA),2021-06-15T03:00:50.827Z
Dev Aprender, Ideias De Projetos Python Intermediários - 7 Categorias,2021-06-15T02:54:10.593Z
Luh Testoni, 4 Apps pra Agendar Post no Instagram! | Luh Testoni,2021-06-15T02:37:39.886Z
Meteoro Brasil, CPI ENCONTRA INDÍCIOS DE CORRUPÇÃO E PLANALTO SE PREPARA PARA O CHOQUE,2021-06-15T02:28:49.517Z
Meteoro Brasil, BOLSONARO É HOSTILIZADO EM AEROPORTO DE VITÓRIA,2021-06-15T02:13:24.116Z
16 mm, MARIGHELLA | Crítica do Filme de Wagner Moura,2021-06-15T01:58:30.083Z
4o Quarto, MARIGHELLA | O PRIMEIRO FILME DIRIGIDO POR WAGNER MOURA | ANÁLISE CRÍTICA,2021-06-15T01:51:40.740Z
CALIBAN I cinema e conteúdo," FILME | Marighella - Retrato falado do guerrilheiro, 2001",2021-06-15T01:47:35.359Z
PravdaTVê, Radio Libertadora - Carlos Marighella,2021-06-15T01:44:16.023Z
Fatos Desconhecidos, O Lado Oculto de Carlos Marighella,2021-06-15T01:40:38.268Z
musicasnota9mais1, Ray Charles - I Can't stop loving you  (Legendado),2021-06-14T21:59:15.525Z
Meteoro Brasil, UM MUNDO SEM PRISÕES É POSSÍVEL?,2021-06-14T21:16:01.092Z
Meteoro Brasil, FECHE O LIVRO E VÁ VER TV,2021-06-14T20:57:13.692Z
NeuroVox, Como Curar Um Coração Partido | PEDRO CALABREZ | NeuroVox,2021-06-14T16:28:01.675Z
Lofi Girl, lofi hip hop radio - beats to relax/study to,2021-06-14T15:52:54.156Z
Canal Tudo Zen, musica para estudar e memorizar com ondas alfa (3 Horas de Mais Foco e Produtividade),2021-06-14T15:52:32.214Z
BuddhaTribe - Relaxation Bar Music Vibe, Musica Relaxante para Estudar e Trabalhar com Ondas Cerebrais 3 Horas,2021-06-14T15:51:51.475Z
Eduardo Mendes, Live de Python #139 - SQLAlchemy ORM,2021-06-14T13:13:34.773Z
Hudson - Tutor Do Marketing," ✅Chat bot, como criar um bot para whatsapp, vender pelo whatsapp, vender no automático, auto reply",2021-06-14T03:24:01.960Z
Aprenda a Fazer, Melhor | APLICATIVO GRATUITO | resposta para Whatsapp,2021-06-14T03:07:52.674Z
Dev Aprender, Como Criar Um Bot(Robô) No Whatsapp de mensagens P/ Grupos e Contatos,2021-06-14T01:53:49.281Z
Dev Aprender, COMO CRIAR UM BOT(robô) NO WHATSAPP de Mensagens Dev Aprender,2021-06-14T01:47:43.521Z
Veslasoft, Programando um BOT em Python para o Instagram - Estrutura de pacotes - [EP1],2021-06-14T01:22:22.503Z
Meteoro Brasil, NATALIA PASTERNAK E CLÁUDIO MAIEROVITCH NA CPI: UM RESUMO,2021-06-13T11:55:06.021Z
iFood Universo, Esquenta W42 - Trilha Data & AI,2021-06-12T18:53:25.450Z
Programador BR," Javascript, Python, PHP? Por qual linguagem de programação começar?",2021-06-12T12:02:36.521Z
Programador BR, O que todo programador iniciante precisa saber.,2021-06-12T11:49:50.260Z
Programador BR, O caminho mais rápido para ganhar dinheiro com programação.,2021-06-12T11:45:29.225Z
Meteoro Brasil, LIVE: CPI DA COVID OUVE NATALIA PASTERNAK E CLAUDIO MAIEROVITCH,2021-06-12T11:43:54.715Z
Meteoro Brasil," PARA LULA, POLARIZAÇÃO É NORMAL E ATÉ BENÉFICA",2021-06-11T16:19:19.584Z
Meteoro Brasil, LIVE: CPI DA COVID OUVE NATALIA PASTERNAK E CLAUDIO MAIEROVITCH,2021-06-11T16:09:57.101Z
Me Salva! ENEM 2021, Me Salva! LOG02 - Logaritmos -  Definição de logaritimos,2021-06-11T15:48:54.108Z
Didática Tech, Como abrir arquivos no Python usando Pandas (Python para machine learning - Aula 11),2021-06-11T15:32:48.680Z
Didática Tech, Aprenda como usar o Numpy (Python para machine learning - Aula 10),2021-06-11T15:15:06.726Z
Walisson Silva, Altere a Aparência dos Gráficos do Matplotlib (Gráficos no Python),2021-06-11T14:25:19.299Z
Walisson Silva, Gerando GRÁFICOS INTERATIVOS (DINÂMICOS) no Python com o Matplotlib,2021-06-11T14:24:38.874Z
Didática Tech, Como criar gráficos em Python com Matplotlib (Python para machine learning - Aula 21),2021-06-11T14:17:14.655Z
Alura Cursos Online, Data Science: Introdução a testes estatísticos com Python,2021-06-11T14:14:34.884Z
Marco Antonio Leonel Caetano, PYTHON 11 Estatística com  Histograma e  Boxplot usando Statistics e Scipy,2021-06-11T14:12:25.930Z
Djonga, Djonga - Ea$y Money (Clipe Oficial),2021-06-10T22:45:39.644Z
Meteoro Brasil," SEM QUERER, JULIANA PAES ARRASTA CELEBRIDADES PARA DEBATE POLÍTICO",2021-06-10T18:44:06.429Z
Maicon Küster, invadindo grupos do whatsapp de apoio ao bolsonaro,2021-06-10T18:43:53.372Z
GamePlaysCassi, CORRAM! EPIC GAMES FORA DE CONTROL! NOVO e ÚLTIMO JOGO GRÁTIS MISTERIOSO FOI REVELADO e JOGOS GRÁTIS,2021-06-10T17:59:36.425Z
Felippe Caetano," AULÃO DE DEGRADÊ, TÉCNICAS E PROCESSO | CORTE DE CABELO PASSO A PASSO",2021-06-09T20:11:51.965Z
Barbearia CFG, TECNICA DE DISFARCE PARA TODOS OS  TIPOS DE CABELO,2021-06-09T19:52:05.157Z
Peixe Babel, Matplotlib vs Seaborn vs Plotly,2021-06-09T14:06:14.310Z
Tomas Edson," Contar Registros do Banco de Dados MYQSL, VISUAL STUDIO-Parte 1",2021-06-09T13:53:32.022Z
Programador Excel VBA, Contar Repetição de Nomes no Listivew | Contar repetidos em subitems no Listview,2021-06-09T13:52:32.045Z
Bóson Treinamentos," 12 - T-SQL - DISTINCT - Consultas com valores distintos, sem repetição - SQL Server",2021-06-09T13:48:46.878Z
titobarrosTI, POSTGRESQL | 1 | Como formatar campos Data no PostgreSQL,2021-06-08T20:58:17.734Z
Ambar Hasbiyatmoko, Postgresql error : convert field character varying to integer,2021-06-08T20:57:54.391Z
Bóson Treinamentos, 37 - Conversão de Tipos de Dados no SQL Server com Cast e Convert,2021-06-08T20:45:15.409Z
Meteoro Brasil, NISE YAMAGUCHI NA CPI: UM RESUMO,2021-06-08T17:08:17.417Z
codigofacilito, Mini Curso SQLAlchemy con Python 1  Crear Modelo,2021-06-08T16:46:17.864Z
Delegado da Cunha, DUAS ABORDAGENS POLÊMICAS COMENTADAS COM O CORONEL TELHADA- DELEGADO DACUNHA- PCSP,2021-06-08T01:28:25.832Z
Enxuga Gelo PodCast - FROID, COMO FAZER UM HIT DE 100 milhões ? | FROID x NEO BEATS | Enxuga Gelo Podcast 🌴,2021-06-08T01:24:54.120Z
Porta dos Fundos, METEORO,2021-06-08T01:19:44.239Z
Meteoro Brasil, THE ECONOMIST QUER MESMO QUE BOLSONARO SEJA ELIMINADO?,2021-06-08T01:16:41.638Z
Meteoro Brasil, QUEM É WAGNER MOURA,2021-06-08T01:00:10.020Z
Cortes Podpah [OFICIAL], VALE A PENA DA VOZ PRA TODOS?,2021-06-08T00:59:50.372Z
"CORTES RAP, FALANDO [OFICIAL]"," IMPORTÂNCIA DO FILIPE RET PRO RAP RJ | rap, falando: cortes",2021-06-08T00:57:24.109Z
About Games, Como Baixar e Instalar GTA 5 COMPLETO PARA PC 2020 (MÉTODO SIMPLES),2021-06-07T21:34:52.721Z
Enxuga Gelo PodCast - FROID, FROID COM CIÚMES DA CYNTHIA LUZ AO VIVO !   | FROID x LUCCAS CARLOS | Enxuga Gelo Podcast 🌴,2021-06-07T20:17:05.285Z
Portal Sublimático, COMO ESTAMPAR CAMISETAS DIFERENCIADAS? - PORTAL RESPONDE,2021-06-07T20:11:23.897Z
SPL GAMES, TOP 10 : NOVOS JOGOS DE MUNDO ABERTO EM 2021 | PS5 / SERIES X|S / PS4/XONE/SWITCH/PC,2021-06-06T21:15:54.126Z
codigofacilito, Mini Curso SQLAlchemy con Python 1  Crear Modelo,2021-06-05T01:13:32.631Z
Programador BR, Pare de Deixar Tudo Para Depois,2021-06-04T15:16:36.548Z
GamePlaysCassi," OPA!! MUITOS JOGOS GRÁTIS no PC PARA RESGATE e JOGAR (EPIC e STEAM), e MELHOR PROMOÇÃO do ANO!!",2021-06-04T14:12:17.086Z
Daniel Morais Infocotidiano, Como usar um subselect  em uma consulta SQL,2021-06-04T13:57:52.415Z
"DesCOMPlica, Oliba!"," PL-PgSQL (Aula 10) - Manipulação de Datas e Timestamps em PostgreSQL - Dia, Mês, Ano, Hora e Minuto",2021-06-04T12:53:56.426Z
titobarrosTI, POSTGRESQL | 1 | Como formatar campos Data no PostgreSQL,2021-06-04T12:45:49.372Z
Marvel Entertainment, LEGO Marvel’s Avengers Trailer,2021-06-04T00:23:40.778Z
Marvel Entertainment, Marvel’s Avengers: A-Day | Official Trailer E3 2019,2021-06-04T00:20:26.671Z
IGN, 13 Minutes of Destroy All Humans! Remake Gameplay,2021-06-04T00:18:49.997Z
Skewed and Reviewed Gareth Von Kallenbach, Stubbs The Zombie: Rebel Without A Pulse Gameplay,2021-06-04T00:17:24.771Z
IGN, Crash Bandicoot 4: It's About Time - Official Trailer,2021-06-04T00:13:53.832Z
IGN, Mafia 3 Definitive Edition - Official Trailer,2021-06-04T00:10:34.209Z
IGN, 25 Minutes of BioMutant Gameplay - PAX 2017,2021-06-04T00:07:25.767Z
Trailers games, Grand Theft Auto V,2021-06-04T00:04:31.502Z
Drew Arvin, The Godfather Game Trailer,2021-06-04T00:03:36.563Z
João Piel Neto, COMO BAIXAR E INSTALAR  QUALQUER JOGO NO SEU PC!!!,2021-06-03T23:52:25.123Z
Capitão Capcom, Os 20 MELHORES JOGOS PARA PC FRACO e JOGOS PARA PC MEDIO em 10 minutos,2021-06-03T23:25:58.462Z
Meteoro Brasil, DESTRINCHANDO O PRONUNCIAMENTO DE BOLSONARO,2021-06-03T23:05:35.653Z
Eduardo Mendes," Novidades do SQLAlchemy (orm async, 2.0 e queries) - Live de Python #166",2021-06-03T21:28:17.161Z
Eduardo Mendes, Live de Python #139 - SQLAlchemy ORM,2021-06-03T20:52:25.129Z
AppNexus, Diversity is Being Invited to the Party: Inclusion is Being Asked to Dance,2021-06-03T20:46:56.262Z
Roni Zeri USA, COMO RECÉM CHEGADO CONSEGUE TRABALHO NOS ESTADOS UNIDOS #2,2021-06-03T17:58:24.802Z
Hostinger Brasil, 🧱 Como Fazer Logo Grátis 🧱 (2021),2021-06-03T17:31:17.735Z
iFood, iFood Pedal - Pedalar por um futuro melhor,2021-06-03T16:13:12.808Z
Tecnología Binaria;, Cómo USAR el CASE en PGSQL | Curso de PostgreSQL #64,2021-06-03T01:03:45.238Z
DataEmpire Soluções, CURSO SQL - CASE (COMO FAZER CASE WHEN THEN),2021-06-03T00:48:28.902Z
Capitão Capcom," GRÁTIS - Os 30 Melhores Jogos para PC FRACO e PC MÉDIO, Jogos leves GRATUITOS!",2021-06-03T00:29:30.176Z
Alessandro Trovato, SQL SERVER - 33 - CASE - Estruturas de decisão para alterar forma de visualização dos dados,2021-06-03T00:18:46.841Z
"CORTES RAP, FALANDO [OFICIAL]"," COMO FOI VER O COMEÇO DO RACIONAIS DE PERTO | rap, falando: cortes",2021-06-02T23:57:48.685Z
Cortes PodMestre [OFICIAL], NOG MANDA PAPO RETO PARA MC SID,2021-06-02T23:51:36.249Z
Roni Zeri USA, COMO RECÉM CHEGADO CONSEGUE TRABALHO NOS ESTADOS UNIDOS #2,2021-06-02T23:14:05.487Z
Daniela Azeredo - USA, AS MELHORES FORMAS DE IMIGRAR EM 2021 PARA OS ESTADOS UNIDOS!,2021-06-02T23:13:49.768Z
"CORTES RAP, FALANDO [OFICIAL]"," VIVÊNCIAS COM O MANO BROWN (RASHID E KAMAU) | rap, falando: cortes",2021-06-02T22:55:47.953Z
"CORTES RAP, FALANDO [OFICIAL]"," RASHID E KAMAU DÃO PAPO RETO SOBRE KAROL E PROJOTA NO BBB | rap, falando: cortes",2021-06-02T22:30:54.272Z
Cortes do Flow [OFICIAL], A ANITTA QUASE FALIU O DENNIS DJ | Cortes do Flow,2021-06-02T22:18:58.302Z
Mariana Cagnin, Como desenhar rostos?,2021-06-02T21:37:34.584Z
Charles Laveso, Vídeo Aula / Desenhando um Rosto Realista - Charles Laveso,2021-06-02T21:27:20.724Z
GuuhDesenhos, COMO DESENHAR O HOMEM ARANHA,2021-06-02T21:12:40.218Z
Beyond The L Word," Piper & Taystee Get Real: ""What Is It About Me That Makes People Wanna Fuck with Me?"" | OITNB | 6x11",2021-06-02T19:13:12.958Z
adsense, https://www.youtube.com/watch?v=1iBED164Pfk,2021-06-02T16:23:16.075Z
Capitão Capcom," GRÁTIS - Os 30 Melhores Jogos para PC FRACO e PC MÉDIO, Jogos leves GRATUITOS!",2021-06-02T00:03:09.824Z
Flow Compilações, OROCHI NO FLOW | MELHORES MOMENTOS,2021-06-01T23:56:24.232Z
adsense, https://www.youtube.com/watch?v=1iBED164Pfk,2021-06-01T23:55:40.210Z
FLASHPOINT GAMES, Top 10 Melhores Jogos Grátis Para PC +Download+ 2021 ( FREE TO PLAY GAMES ),2021-06-01T23:51:10.501Z
BeardedDev, SQL Tutorial - CASE Statements,2021-06-01T19:45:43.064Z
PG Casts by Hashrocket, Postgres Conditionals: How to Use Case,2021-06-01T19:45:33.203Z
Dickson S. Guedes, Entenda CASE SENSITIVE no PostgreSQL em 5 minutos,2021-06-01T19:44:42.467Z
Zurubabel, SQL Server Intermediário (Aula 9) - Comando Case,2021-06-01T19:30:41.975Z
Emicida," Emicida - Papel, caneta e coração",2021-06-01T16:23:00.305Z
Coruja BC1, Coruja BC1 - MODO F (J Cole - A Tale of 2 Cities - REMIX),2021-06-01T16:18:20.189Z
Froid, Froid - Peita de dar Rolê,2021-06-01T16:14:58.557Z
nk music," [FREE] Isaiah Rashad x Kendrick Lamar x J. Cole Chill Type Beat | ""Telesto""",2021-06-01T16:09:08.420Z
nk music," [FREE] Isaiah Rashad x J. Cole x Kendrick Lamar Lofi Type Beat | ""Hermes""",2021-06-01T16:03:35.599Z
Emicida, Emicida - AmarElo (Sample: Belchior - Sujeito de Sorte) part. Majur e Pabllo Vittar,2021-06-01T16:03:32.382Z
SZAVEVO, SZA - The Weekend (Audio),2021-06-01T16:03:08.516Z
DonLMusic, 03. Don L - Aquela Fé (feat. Nego Gallo),2021-06-01T15:56:59.518Z
Salvador da Rima, Salvador - “Vergonha Pra Mídia” (Feat. MC Ryan SP/Nog/Kevin/Lele JP) [Prod. Dj Boy/Nine/Ramiro],2021-06-01T15:51:49.872Z
Rap Box, Djonga | Clara Lima | FBC | Hot & Oreia - Diáspora - DV Tribo [Ep.109],2021-06-01T15:46:17.406Z
nk music," [FREE] J. Cole x Isaiah Rashad x Kendrick Lamar Type Beat | ""Triton""",2021-06-01T15:40:07.357Z
BK', 3. Quadros part. Ashira e Luccas Carlos (Prod. JXNVS),2021-05-31T23:12:36.815Z
FBC, FBC - AUTO AJUDA,2021-05-31T23:05:44.372Z
Eduardo Mendes, Live de Python #139 - SQLAlchemy ORM,2021-05-31T23:03:00.435Z
Stress," (FREE) Pop Smoke x Gunna x Sidoka Type Beat - ""Japan"" (Prod. Stress)",2021-05-31T21:11:35.210Z
Stress," (FREE) Future x Jovem Dex Type Beat - ""Money Rain"" (Prod. Stress)",2021-05-31T21:09:01.381Z
Stress," (FREE) Brandão x Aimar x Teto x Gunna - ""Lacoste"" (Prod. Stress)",2021-05-31T21:05:41.386Z
Stress," (FREE) Orochi x Filipe Ret x L7NNON Type Beat - ""Isqueiro"" (Prod. Stress)",2021-05-31T21:02:31.786Z
Prod. Ttheuz1n," (FREE) Teto x Aimar x Reid Type Beat ""Cash"" (Prod. Ttheuz1n)",2021-05-31T20:58:07.108Z
