Canal,Nome vídeo,Data
IDEIAS INCRÍVEIS Brincadeiras, 8 IDEIAS IMPRESSIONANTES DE COMO BRINCAR E SE DIVERTIR,2021-07-18T22:37:01.019Z
adsense, PRA VALER E MR.DAN - BIPOLAR ( DVD 15 ANOS )   #grupopravaler #mrdan #bipolar,2021-07-17T01:07:04.129Z
Instituto Montanari, 4 PARCELA AUXÍLIO EMERGENCIAL ANTECIPADA? JOÃO ROMA FALA TUDO BOLSA FAMÍLIA CALENDÁRIOS CADASTROS,2021-07-13T16:22:41.171Z
Instituto Montanari," 4 PARCELA CALENDÁRIO AUXÍLIO EMERGENCIAL BOLSA FAMÍLIA VALOR R$280 + 48,8 MILHÕES DE BENEFICIÁRIOS?",2021-07-13T16:22:37.999Z
Cortes PodMestre [OFICIAL], O JEITO CERTO DE CHUP4R UMA BCTA l MIA LINZ,2021-07-13T16:19:13.740Z
Glaudimar Pedroza, Concurso da PCERJ: Banca definida - CEBRASPE,2021-07-12T16:17:48.263Z
adsense, Conta Digital Banco PAN | A conta que é todinha pra você,2021-07-12T16:16:34.159Z
SHISUI Games & Animes, Os 9 Jinchuurikis formam uma aliança Para Derrotar Gedo Mazo | Naruto Shipuden,2021-07-08T17:50:46.195Z
adsense, Funny video 5208000076863994917 Upload via Kwai on 2021-07-06,2021-07-08T17:50:13.015Z
GEAN GT," Sasuke vs Kakashi - luta completa legendado PT BR ,",2021-07-06T17:40:28.494Z
Animação Animes TV, Naruto ganha de Neji e surpreende a todos - Naruto vs Neji _ Naruto (FULLHD),2021-07-04T10:15:21.377Z
Quadro Móvel, COMO LEGENDAR VÍDEO AUTOMATICAMENTE E GRÁTIS! SENSACIONAL (2021),2021-07-04T10:15:06.194Z
Juan Marcus & Vinícius - Topic, Alguns Defeitos (Ao Vivo Em São José Do Rio Preto / 2019),2021-07-04T10:14:54.844Z
Barone #Shorts, Como abrir um CARRO sem as chaves !,2021-07-04T10:14:00.282Z
Gabi Haxkar, REALIZEI O SONHO DE MUITA GENTE,2021-07-04T10:13:29.966Z
Raulfy Daniel, 2 de julho de 2021,2021-07-04T10:13:26.755Z
Risadinha De Ladrão, CABISBAIXO VENDENDO PICOLÉ,2021-07-04T10:12:25.326Z
GUI POLÊMICO, Quando você leva o celular pro banheiro e sua mulher pensa besteira kkkkkkkk,2021-07-04T10:11:30.198Z
O Netinho, Homem aranha no aranhaverso,2021-07-04T10:10:35.609Z
Sivonaldo Oliveira, Tiro com o silenciador,2021-07-04T10:09:55.227Z
tik Tok do Renato Garcia, tik Tok de Renato Garcia ❤️😍,2021-07-04T10:09:44.680Z
Guilherme Tank, CREDO Q DELÍCIA KK VÍDEO NOVOOO,2021-07-04T10:08:43.411Z
Spiderbritto, Homem aranha voando no balanço infinito em pé,2021-07-04T10:08:26.121Z
GUI POLÊMICO, Me de um motivo pra mim não quebrar a sua cara de novo?? 😡😡😡,2021-07-04T10:07:22.503Z
Enaldinho, TROCANDO FIDGET TOYS DE UM JEITO DIFERENTE COM MEU IRMÃO! #shorts,2021-07-04T10:06:56.766Z
vídeos legal, O cara com dinheiro e outra coisa,2021-07-04T10:06:32.821Z
Delegado da Cunha," AFINAL, DACUNHA É 13 OU 17? - DACUNHA NA ESCUTA COM MAURICIO MEIRELLES",2021-06-25T16:21:43.138Z
Rooster Time, [SFM FNaF] Nightmare VR vs Toxic Animatronics,2021-06-22T19:43:51.211Z
Fábrica de Idiotas Oficial, ANIMAÇÃO - FNAF 2  PREQUEL,2021-06-22T19:43:31.255Z
Canal do Vipper, 5 AM at Freddy's: A PEGADINHA - Dublado PT/BR,2021-06-22T19:43:24.329Z
GH'S, AMONG US CUP SONG COMPLETE EDITION #4,2021-06-22T19:42:11.008Z
Melhores Trailers de Filmes," PATRULHA CANINA: O FILME Trailer Brasileiro DUBLADO (Animação, 2021)",2021-06-22T19:38:18.448Z
Netflix BFF, Sharkboy and Lavagirl | We Can Be Heroes| netflix,2021-06-22T19:37:26.687Z
Miramax," The Adventures of Sharkboy and Lavagirl | 'Brrrr, It's Cold In Here' (HD) | MIRAMAX",2021-06-22T19:36:52.770Z
Stop Motion Cooking, Someone Please Save TOM & JERRY - Funny Food Animation | Stop Motion Cooking & ASMR,2021-06-22T19:02:55.997Z
Cortes do Flow [OFICIAL], CIRO GOMES E SEU PLANO DE GOVERNO PARA 2022 | Cortes do Flow,2021-06-21T14:43:30.884Z
Cortes do Flow [OFICIAL], CIRO GOMES CRITICA MODELO TRIBUTÁRIO BRASILEIRO | Cortes do Flow,2021-06-21T14:37:11.045Z
Cortes do Flow [OFICIAL], CIRO GOMES EXPÕE DADOS SOBRE GOVERNO PETISTA | Cortes do Flow,2021-06-21T14:28:40.358Z
Cortes do Flow [OFICIAL], CIRO GOMES SE IRRITA E EXPLANA BOLSONARO AO VIVO | Cortes do Flow,2021-06-21T14:10:25.738Z
Cortes do Flow [OFICIAL], MONARK IMPRESSIONOU CIRO GOMES COM SUGESTÃO | Cortes do Flow,2021-06-21T14:06:28.588Z
Cortes do Cometa [OFICIAL], A VERDADE SOBRE O BOM DIA E COMPANHIA | Cortes do Cometa,2021-06-18T22:07:40.507Z
Instituto Montanari," 3 PARCELA AUXÍLIO EMERGENCIAL PAGAMENTO HOJE! BOLSA FAMÍLIA DE R$ 300, E AGORA?",2021-06-18T22:01:03.180Z
Cortes De Todos os Podcasts, DELEGADO DA CUNHA PEDE DESCULPAS APÓS ERRO NO PODPAH,2021-06-18T21:54:10.478Z
Canal XProjetos, COMO FAZER UMA RABIOLA PARA PIPA,2021-06-18T13:39:50.249Z
Canal XProjetos, COMO FAZER CABRESTO DE PIPA,2021-06-18T13:18:35.821Z
rezendeevil, QUEM É O MAIS ESPERTO? ( WHO IS SMARTER? ) #shorts,2021-06-18T00:54:15.180Z
ser feliz é tão fácil ., Vou mostra quem é jubileu.kkkkkkkkk.,2021-06-18T00:53:44.211Z
Sau Sampaio, CARANGUEJO RECEITA RÁPIDA E FÁCIL - Como fazer caranguejo,2021-06-18T00:52:56.582Z
Hinatinha Hyuga, Deidara no leilão kkkk 👇 descrição,2021-06-18T00:52:49.877Z
Mec Tagger, Orochi Falando do Bonde da Stronda no Flow Podcast Leo Stronda & Diego Thug,2021-06-18T00:52:18.109Z
Raphael Droid, JOÃO CAETANO FICA MEXENDO NO CELULAR DURANTE O FLOW PODCAST,2021-06-18T00:51:37.871Z
Talk Flow, TOGURO CONFRONTA FLOW,2021-06-18T00:47:32.704Z
Flow Podcast e PodPah - Cortes, DELEGADO DA CUNHA SOBRE TROPA DE ELITE,2021-06-18T00:37:26.449Z
Nick Pro, Naruto VS Goku In Real Life (Parkour Battle),2021-06-16T21:02:11.409Z
Thelastbrickblender, Lego Spider-man vs Mysterio! Recreation Blender,2021-06-16T21:01:26.938Z
boruto sensei, naruto minato kushina edit,2021-06-16T21:00:45.189Z
Los Wagners, ABRIU A GARRAFA COM O PÉ? 👀🍾,2021-06-16T21:00:43.984Z
GUI POLÊMICO," Os caras veio corta a minha luz, meti maior broncão kkkkkkkk",2021-06-16T21:00:40.215Z
Guilherme Tank, A COCA-COLA FICOU TRANSPARENTE ???,2021-06-16T21:00:37.148Z
Netflix BFF, Sharkboy and Lavagirl | We Can Be Heroes| netflix,2021-06-16T20:09:34.338Z
Netflix Latinoamérica," Superheroicos, con Priyanka Chopra Jonas y Pedro Pascal | Tráiler oficial | Netflix",2021-06-16T20:08:52.010Z
mundo Da alyce, Arlequina bebê versus Alerquina Mãe Versus Arlequina,2021-06-16T20:07:46.464Z
Instituto Montanari, 3 PARCELA CALENDÁRIO AUXÍLIO EMERGENCIAL 2021 BOLSA FAMÍLIA PAGAMENTOS ANTECIPADOS!,2021-06-16T15:47:58.998Z
MundoDasCriancasTV, Parabéns pra voce - Música Infantil - Canções Populares,2021-06-14T14:26:04.285Z
Melhores Trailers de Filmes," PATRULHA CANINA: O FILME Trailer Brasileiro DUBLADO (Animação, 2021)",2021-06-14T14:25:25.705Z
Produções do Futuro, O FILME DA PATRULHA CANINA TRAILER DUBLADO COMPLETO,2021-06-14T14:25:11.085Z
💧Nya Walker💧, Paw Patrol: The Movie edit!|Nya Walker!,2021-06-14T14:23:40.283Z
Yasmin Verissimo, Mamãe - Yasmin Verissimo - Música dia das mães,2021-06-14T14:12:36.018Z
Bolofofos, MÚSICA DE ANIVERSÁRIO | Bolofofos | Parabéns pra você,2021-06-14T14:10:36.357Z
QUELLY SILVA Dicas para o Departamento Infantil, PARABÉNS HOJE É SEU ANIVERSÁRIO 🎼🎉 Música para aniversário,2021-06-14T14:09:35.606Z
Astuces du Panda, HALLOWEEN | IDÉES DE MAQUILLAGE EFFRAYANT ET IDÉES DE COSTUMES DIY,2021-06-14T02:50:00.978Z
adsense, https://www.youtube.com/watch?v=s08Gr1HtaHo,2021-06-14T02:49:20.069Z
Bobzin Zueiro, PEPPA PIG DA ZUEIRA - O BOLO DE COCÔ,2021-06-14T02:47:38.324Z
Stop Motion Cooking, Someone Please Save TOM & JERRY - Funny Food Animation | Stop Motion Cooking & ASMR,2021-06-14T02:42:09.326Z
O Netinho, Quando o celular fica com 1%,2021-06-14T02:41:34.448Z
Janilson Silva, REACT -  ESTRUIU O M&M🥲,2021-06-14T02:41:32.126Z
Guilherme Tank, O FOGO APAGA CANETA??? OLOKO,2021-06-14T02:40:26.861Z
CANAL KKK, O STEVE JOB's TÁ FAZENDO MILAGRE LÁ DO CÉU...,2021-06-14T02:40:25.165Z
adsense, https://www.youtube.com/watch?v=-VirGCO17DI,2021-06-14T02:40:21.541Z
CREMOSINHO FC, cremosinho dançando Quando você tem a arte da sedução,2021-06-14T02:40:19.403Z
V1ctorian0, SEMPRE TEM! 😂,2021-06-14T02:40:17.963Z
Cacau Haxkar, Amigo Caloteiro,2021-06-14T02:40:11.217Z
O Netinho, Copo de água,2021-06-14T02:39:10.915Z
adsense, https://www.youtube.com/watch?v=DX2Jr0VuBeU,2021-06-14T02:39:08.261Z
Gabriel Boruto Otaku, uno Luccas neto,2021-06-14T02:38:37.924Z
ProSidu, MEGA ESPIRAL SPIRAL ROLL,2021-06-14T02:38:36.581Z
Cacau Haxkar, Amigas por acaso😂,2021-06-14T02:38:34.847Z
GUI POLÊMICO, Um milagre que não deu certo kkkkkkkk,2021-06-14T02:38:33.323Z
adsense, https://www.youtube.com/watch?v=BNfVACOPWDg,2021-06-14T02:38:30.207Z
Você antenada TikTok ✔, E se o Homem Aranha fizesse a trend Buss it,2021-06-14T02:38:19.493Z
MGAMES_TV, Marvel's Spider-Man | Серия 1 | PS4 PRO,2021-06-14T02:38:05.711Z
Oli Natu, QUANDO SEU AMIGO É LADRÃO,2021-06-14T02:36:30.825Z
CANAL KKK, NAO SABE NEM BRINCAR,2021-06-14T02:36:01.798Z
DANIEL PIMENTINHA, 22 de março de 2021,2021-06-14T02:36:00.445Z
GUI POLÊMICO, Catador de linha merece oque ??? 😡😡😡,2021-06-14T02:35:56.702Z
adsense, https://www.youtube.com/watch?v=bcXMfKVDWuY,2021-06-14T02:35:54.251Z
O Netinho, Quando eu demoro de atender o motoboy,2021-06-14T02:35:48.932Z
Canal da Sossô, O suco acabou!,2021-06-14T02:32:56.037Z
MEMES KWAI, MEMES - COMO NUNCA MAIS SER ASSALTADO,2021-06-14T02:32:53.008Z
adsense, https://www.youtube.com/watch?v=sbw36f-JrKg,2021-06-14T02:32:19.851Z
Oli Natu, QUANDO O REI LEÃO É AMOEBA,2021-06-14T02:31:50.499Z
Guilherme GDP Gamer, MIOJO EM DIFERENTES LINGUAS,2021-06-14T02:31:44.887Z
ProSidu, DE GORDO A MAGRO,2021-06-14T02:31:04.680Z
Léo Léo, PREGUIÇA DE LAVAR A LOUÇA 😂😫,2021-06-14T02:30:45.328Z
Cacau Haxkar, Aaaa esse final😱😱,2021-06-14T02:30:10.556Z
GUI POLÊMICO, Me da só um motivo pra mim não quebrar a sua cara de novo 😡😡,2021-06-14T02:28:48.886Z
laud TV, Circo dos Horrores/música,2021-06-14T02:28:25.906Z
Maria Clara & JP, Maria Clara e JP fazem o desafio quente vs frio 🔥❄️ Maria Clara and JP made a Hot vs Cold challenge.,2021-06-14T00:52:06.229Z
Maria Clara & JP, Maria Clara e JP comem batatas misteriosas de Halloween | Halloween stories for kids,2021-06-14T00:46:40.515Z
MundoDasCriancasTV, Parabéns pra voce - Música Infantil - Canções Populares,2021-06-14T00:22:27.344Z
Instituto Montanari, 13/06 AUXÍLIO EMERGENCIAL NOVO BOLSA FAMÍLIA AUMENTO DO VALOR EM MAIS DE 50%? ENTENDA AQUI!,2021-06-13T20:09:11.979Z
Instituto Montanari, 12/06 CONFIRA OS VALORES PRORROGAÇÃO AUXÍLIO EMERGENCIAL BOLSA FAMÍLIA VAI ATÉ QUANDO,2021-06-13T20:07:29.010Z
Programe Python, RANGE vs LINSPACE vs ARANGE - Qual a diferença? Python NUMPY,2021-06-12T17:18:32.262Z
Dubla Mundos, A Evolução de Chucky 1988-2019  (animação) Dublado - Brinquedo Assassino,2021-06-11T16:43:49.981Z
Nicoly Oliveira, Luisa sonza vs Virgínia Fonseca #2,2021-06-11T16:37:52.090Z
Instituto Montanari, 5 PARCELA AUXÍLIO EMERGENCIAL OU PRORROGAÇÃO ATÉ FINAL DO ANO? BOLSA FAMÍLIA AUMENTO DO VALOR? VEJA!,2021-06-06T13:07:05.395Z
Nerds de Negócios, MINHA FAMILIA CRIOU A MAIZENA E A VIGOR - Entrevista com meu Pai,2021-06-06T01:08:43.105Z
Flow Podcast e PodPah - Cortes, DA CUNHA E GABRIEL MONTEIRO SOBRE ABORDAGENS POLÊMICAS,2021-06-06T00:38:30.999Z
I Craft, Building 3 in 1 Heart Aquarium with Cement and Brick - DIY Gaden Decoration,2021-06-04T14:48:55.687Z
I Craft, Garden Designs | Setup 2 in 1 Heart Aquarium with Cement and Brick,2021-06-04T13:32:51.343Z
Talk Flow, DIFERENÇA PCC X COMANDO VERMELHO,2021-06-04T13:22:40.014Z
Flow Podcast e PodPah - Cortes, DELEGADO DA CUNHA SOBRE PEDRlNH0 M*TAD0R,2021-06-04T13:17:39.122Z
TeleObjetiva, Holter 24 Horas e o diagnóstico de arritmias,2021-06-03T19:06:32.259Z
Pilar Hospital, Eletrocardiograma e Holter ECG 24 horas,2021-06-03T19:05:43.681Z
Revista da Manhã, Patricia Abravanel causa polêmica após minimizar homofobia - Revista da Manhã (02/06/21),2021-06-03T13:00:28.926Z
Mitsumasa, GOKU vs NARUTO - EPIC RAP BATTLE - REAL LIFE - BATALHA DE RAP - VIDA REAL -ERB,2021-05-31T23:28:18.367Z
Canal Conspiração, NARUTO NO BRASIL 5,2021-05-31T23:18:16.385Z
Mamute Congelado, ♫ MÚSICA DO NARUTO (O golpe ta ai PARÓDIA - Menor Nico e Matheuzinho),2021-05-31T23:14:29.691Z
Lowcarbcomedy, Social Mediasochist II - On and On | Foster & Lowcarbcomedy | Romantic Horror Parody Music Video,2021-05-31T23:13:12.232Z
Lowcarbcomedy, Common Shiner's Social Mediasochist | Lowcarbcomedy | Teen Slasher Romantic Parody Music Video,2021-05-31T23:10:51.323Z
Dubla Mundos, A Evolução de Jason Voorhees (Animação) Dublado | Sexta-feira 13,2021-05-31T23:09:44.234Z
Dubla Mundos, A Evolução de Pennywise - IT a Coisa (animação) Dublado,2021-05-31T23:06:47.855Z
Dubla Mundos, A Evolução de Chucky 1988-2019  (animação) Dublado - Brinquedo Assassino,2021-05-31T23:05:02.865Z
Damoto Edições, (REEDITADO) Rap do Miles Morales (Aranhaverso) - O NOVO HOMEM ARANHA | NERD HITS,2021-05-31T23:04:17.867Z
Mamute Congelado," ♫ MÚSICA DO SIREN HEAD ( Toma PARÓDIA - Luisa Sonza, MC Zaac)",2021-05-31T23:03:55.761Z
TK RAPS," Rap Então Me Sacrifico (Homem de Ferro, Guy, Ace.....) // TK RAPS",2021-05-31T23:03:15.645Z
Thiaguinho Winchester TM, Rap Do Siren Head (Cabeça De Sirene) - A CAÇA VAI COMEÇAR!! | Thiaguinho Winchester,2021-05-31T23:02:20.694Z
Enaldinho, MINHA NAMORADA USOU O BICHINHO BIPOLAR! #shorts,2021-05-31T23:01:07.537Z
TONN616, HOMEM-ARANHA REVOLTADO,2021-05-31T23:00:51.311Z
DNX SASUKE, Rap do homem-aranha,2021-05-31T23:00:43.274Z
Dois Por Cento TV, Expliquem essa Terrappanistas! 😂 #shorts,2021-05-31T23:00:41.881Z
aranha de ferro, rap homem de ferro ultimato,2021-05-31T22:59:26.919Z
Kitty _sak :3, Mds wow tão fofos o Naruto e o Kurama [ | memes/anime Naruto part 18 | ],2021-05-31T22:58:39.707Z
tio Itachi, Edite Boruto e himawari modo Kurama,2021-05-31T22:58:29.274Z
EL_ENZO FF¿, rap itachi edit,2021-05-31T22:57:29.356Z
Julia_Gacha :3, APRESENTAÇÃO DA AKATSUKI,2021-05-31T22:56:45.099Z
30PRAUM, Teto - M4 feat. Matuê,2021-05-31T22:56:23.459Z
LexClash, Rap do Miles Morales 🕸️ (PS5 | PS4) | SPIDER MAN | LexClash,2021-05-31T22:55:20.630Z
DinoSonso, Menino vendia na Rua  vira Modelo,2021-05-31T22:53:46.889Z
JORNAL DAS FAVELAS, PM BOPE PRENDE CHEFÃO DO CV W DA ROCINHA E CRIAS DA TROPA DO URSO NO SÃO CARLOS MINEIRA TCP X CV RJ,2021-05-31T22:53:36.760Z
Spiderbritto, Homem aranha chutando lata de ...,2021-05-31T22:52:01.134Z
Remela da Chapada!!!, Efeito dominó duplo de lajotas e como fazer na descrição!,2021-05-31T22:51:56.457Z
CANAL KKK," FOI SÓ SENTIR A GALHADA NASCER, QUE...",2021-05-31T22:51:45.227Z
Junior Silva, Vem fazer cri cri no exército,2021-05-31T22:51:38.283Z
Matheus Otaku, Naruto,2021-05-31T22:51:27.175Z
Julio Giani, TIPOS DE CICLISTAS NO PUMP TRACK 🤣 #shorts,2021-05-31T22:49:04.280Z
Pedro Maia Oficial, MC PEDRINHO sendo super carinhoso com as FÃS e rindo junto,2021-05-31T22:49:02.308Z
CANAL KKK, FEBRE DO LOCO,2021-05-31T22:48:48.452Z
canal precioso games, sharkboy e lava girl 2005 vs 2020,2021-05-31T22:48:33.811Z
Little Miss Moir, [The Adventures of Sharkboy and Lavagirl] Dream - Robert Rodriguez || Synthesia Piano Tutorial,2021-05-31T22:48:14.401Z
Tudo e Mais Um Pouco, SOLTANDO PIPA 💙💙💙💜🤩😱🌏,2021-05-31T22:45:47.065Z
Momentum Pictures, NEKROTRONIC - Official Trailer,2021-05-30T20:15:00.517Z
CBS Films, SCARY STORIES TO TELL IN THE DARK - Official Trailer - HD,2021-05-30T20:11:40.802Z
Vertical Entertainment US, Look Away | Official Trailer (HD) | Vertical Entertainment,2021-05-30T20:10:23.265Z
Refúgio Cult, 6 SÉRIES SENSACIONAIS NA AMAZON E NA NETFLIX PRA VER AGORA MESMO,2021-05-29T05:38:55.297Z
Metralhadora de motivAÇÃO - Lucas Neto, SÓ VEJA SE QUER SER POLÍCIA!,2021-05-28T15:00:12.864Z
Trechos Maromba, PRISÃO DO MAIOR TRAFICANTE INTERNACIONAL *André do Rap* - Delegado Da Cunha | Ironberg Podcast,2021-05-28T14:58:23.717Z
pobre na cozinha, Ele E Top De Vendas! Fiz 50 Copinhos Para Vender Por 1.00$,2021-05-28T14:55:20.078Z
adsense, BANCO PAN -  BLAST,2021-05-28T14:55:06.443Z
Flow Podcast e PodPah - Cortes, COMO PEDRlNH0 PASSOU 42 AN0S NA PRISÃ0,2021-05-28T14:51:44.566Z
Tele Silk, Dicas de Balcão - Silk | 7. Como Esticar a Tela,2021-05-28T13:39:38.941Z
Serigrafia - Jean do Silk," Fixador de Emulsão, Endurecedor de Emulsão pra que serve e como utilizar! -  episódio 64",2021-05-27T14:23:01.519Z
Canal IN, INVADIMOS A MANSÃO MAL ASSOMBRADA - ESPECIAL HALLOWEEN,2021-05-26T22:07:27.217Z
Trechos Maromba, DIA QUE UM POLICIAL QUIS PRENDER O DA CUNHA *ele mitou* - Delegado Da Cunha | Ironberg Podcast,2021-05-26T22:05:10.900Z
Escolta Armada RJ," Escolta RJ - Ladrões desistem de praticar assalto após pedestre sacar arma, confira !",2021-05-26T22:04:34.378Z
DinoSonso, Tiramos ela das RUAS,2021-05-26T22:03:59.848Z
Ruty Dias, Jogo do palhaço assassino,2021-05-26T22:02:07.347Z
brian games ff, A primeira vez no jogo do palhaço assassino,2021-05-26T22:01:23.575Z
Vídeos Perturbadores, Sonhe Sonhe Sonhe | As Aventuras de SharkBoy e Lavagirl em 3D,2021-05-26T21:59:05.934Z
adsense, https://www.youtube.com/watch?v=J_wjF_EL5l8,2021-05-26T21:55:07.067Z
adsense, https://www.youtube.com/watch?v=AS-SemrLJa0,2021-05-26T21:32:45.915Z
adsense, https://www.youtube.com/watch?v=3z2dujCfzBY,2021-05-26T21:29:55.306Z
adsense, https://www.youtube.com/watch?v=g49yOHgXmI8,2021-05-26T21:26:33.808Z
adsense, https://www.youtube.com/watch?v=0qvBiPalvXY,2021-05-26T21:23:13.998Z
MILLY," (FREE) Moneybagg Yo x Pooh Shiesty x Big Scarr Type Beat 2021 - ""God's Plan""",2021-05-26T01:26:24.159Z
27Corazones Beats, [FREE] Lil Baby x Quavo Type Beat '700' Free Trap Beats 2021 - Rap/Trap Instrumental,2021-05-26T01:26:12.295Z
Danilo Snider, SGT Cavalcanti da ROTA - O dia que enquadrei o Mano Brown !,2021-05-26T01:24:47.540Z
adsense, https://www.youtube.com/watch?v=sK7vDveR78c,2021-05-24T21:24:23.707Z
adsense, https://www.youtube.com/watch?v=FLu8_D_w9-k,2021-05-24T21:21:40.161Z
adsense, https://www.youtube.com/watch?v=J_wjF_EL5l8,2021-05-24T21:18:51.105Z
MxGamer789 K.O, PEQUENOS GRANDES HERÓIS - FILME 2020 - TRAILER OFICIAL NETFLIX,2021-05-24T21:12:45.210Z
Netflix Brasil," Pequenos Grandes Heróis, com Priyanka Chopra Jonas e Pedro Pascal | Trailer oficial | Netflix",2021-05-24T21:12:39.987Z
adsense, Sombra e Ossos  Temporada 1 | Netflix,2021-05-23T23:39:15.920Z
Marcelo Kimura, Arte e Design: qual a diferença?,2021-05-21T21:01:21.325Z
IDEIAS INCRÍVEIS, PISTOLA DE COLA QUENTE VS. CANETA 3D! ESTE É UM NOVO NÍVEL DE ELABORAÇÃO,2021-05-21T16:24:57.782Z
IDEIAS INCRÍVEIS, COMO FAZER QUALQUER COISA COM UMA CANETA 3D E COLA QUENTE || ARTESANATOS FOFOS,2021-05-21T16:22:17.845Z
Ideias Incríveis HOMENS, 13 IDEIAS INCRÍVEIS PARA DESENHOS,2021-05-21T16:18:02.298Z
IDEIAS INCRÍVEIS, 22 TRUQUES FÁCEIS DE DESENHOS PARA INICIANTES || TUTORIAIS E DICAS DE DESENHO E PINTURA,2021-05-21T16:09:16.399Z
TechZone, BRINQUEDOS INCRÍVEIS QUE ESTÃO EM UM NOVO NÍVEL,2021-05-21T16:07:10.427Z
IDEIAS INCRÍVEIS, 36 DICAS FANTÁSTICAS COZINHA PARA PRINCIPIANTES QUE SÃO REALMENTE T FÁCEIS,2021-05-21T16:03:48.140Z
TechZone, 10 BRINQUEDOS DIVERTIDOS QUE TODO MUNDO VAI CURTIR,2021-05-21T16:01:03.326Z
TechZone, 9 BRINQUEDOS LEGAIS DE ÚLTIMA GERAÇÃO,2021-05-21T16:00:19.359Z
Cortes do Flow [OFICIAL], APANHOU POR FAZER PIADA  | Cortes do Flow,2021-05-21T15:59:05.274Z
Tudo e Mais Um Pouco, MELHORES PIPAS DO MUNDO 😱😍🌏,2021-05-21T15:57:43.654Z
Flow Podcast e PodPah - Cortes, DELEGADO DA CUNHA FALA SOBRE GABRIEL MONTEIRO,2021-05-21T15:57:05.354Z
adsense, FICANDO LOUCO COM KURT COBAIN ✂ JOÃO GORDO,2021-05-21T12:26:03.893Z
Cortes do Flow [OFICIAL], CRIME ORGANIZADO NO BRASIL | Cortes do Flow,2021-05-21T12:20:47.460Z
Flow Podcast e PodPah - Cortes, IGOR ASSUME PRO DELEGADO DA CUNHA QUE FOI CHAMADO PRA MILÍCIA,2021-05-21T12:12:06.074Z
Talk Flow, CONVIDARAM IGOR PRA MILÍCIA,2021-05-20T22:03:57.986Z
Cortes do Flow [OFICIAL], FLOW E DA CUNHA DEBATEM LEGALIZAÇÃO DAS DROGAS | Cortes do Flow,2021-05-20T21:42:58.066Z
Cortes do Flow [OFICIAL], MONARK É PRESO AO VIVO | Cortes do Flow,2021-05-20T21:40:42.727Z
Flow Podcast e PodPah - Cortes, DELEGADO DA CUNHA SOBRE OPERAÇÃO NO JACAREZINHO,2021-05-20T21:31:10.123Z
Flow Podcast e PodPah - Cortes, DELEGADO DA CUNHA NÃO PODE PRENDER O MONARK?,2021-05-20T21:09:01.022Z
Tudo e Mais Um Pouco, MELHORES FILMES ANIMADOS DO MUNDO 🌏 😱❤️,2021-05-20T19:05:13.069Z
Tudo e Mais Um Pouco, SLIMES MAS BONITAS DO MUNDO 😱🌏😍,2021-05-20T19:05:09.084Z
Leticia Siuva, como ATIVAR os COMENTÁRIOS do VÍDEO NO YOUTUBE 2021 (ATUALIZADO),2021-05-20T18:54:59.471Z
Grupinho Da Lobinha," Tutorial,como ativar os comentários do seu vídeo",2021-05-20T18:50:19.782Z
TechZone, BRINQUEDOS INCRÍVEIS QUE ESTÃO EM UM NOVO NÍVEL,2021-05-20T12:59:29.764Z
adsense, https://www.youtube.com/watch?v=wIm33oURdlc,2021-05-20T12:00:39.727Z
Flow Fora de Contexto, como perder patrocínio em 40 segundos *speedrun*,2021-05-20T11:59:35.058Z
Escola de Pipeiros, As 5 Melhores pipas para soltar (Segundo alunos do canal) | Escola para Pipeiros,2021-05-20T03:02:22.504Z
Tudo e Mais Um Pouco, SLIMES MAS BONITAS DO MUNDO 😱🌏😍,2021-05-20T02:17:35.124Z
Cortes do Flow [OFICIAL], MONARK DANDO AULA SOBRE YOUTUBE | Cortes do Flow,2021-05-17T21:14:24.766Z
Flávio M Machado, Quando se bate um carro a ~ 200 km/ h ...🚗💥💢#pancada,2021-05-17T21:14:15.535Z
Flow Podcast e PodPah - Cortes, DELEGADO DA CUNHA ESCULACHA MONARK DO FLOW PODCAST,2021-05-16T18:06:41.103Z
Flow Podcast e PodPah - Cortes, DELEGADO DA CUNHA - POLÍCIA PODE OBRIGAR A DESBLOQUEAR O CELULAR? E INVADIR CASA SEM MANDADO?,2021-05-15T12:50:21.907Z
Cortes do Flow [OFICIAL], IGOR SE IRRITA COM DEFANTE E ABANDONA CONVERSA | Cortes do Flow,2021-05-15T12:44:05.794Z
Cortes do Flow [OFICIAL]," DEFANTE QUEBRA O FONE DO FLOW E VAZA, ANÃO MANDA A REAL | Cortes do Flow",2021-05-15T12:40:36.863Z
Cortes do Flow [OFICIAL], A CASA CAIU | Cortes do Flow,2021-05-15T12:40:07.644Z
Cortes do Flow [OFICIAL], CONVIDADA DEIXA MONARK SEM PALAVRAS | Cortes do Flow,2021-05-15T12:36:16.096Z
adsense,Visited https://zenbook.com.br/,2021-05-15T12:32:29.284Z
Cortes do Flow [OFICIAL], SOBRE O IMPEACHMENT DO BOLSONARO | Cortes do Flow,2021-05-15T12:16:27.559Z
Cortes do Flow [OFICIAL], TRETA NO GRANDE DEBATE DA CNN | Cortes do Flow,2021-05-15T12:08:35.335Z
Flow Podcast e PodPah - Cortes, CLIMA FICA TENSO ENTRE MONARK E GABRIELA PRIOLI EM DEBATE (Flow Podcast),2021-05-15T11:55:29.321Z
Culinária em Casa, LEITE NA PIPOCA -FICA MELHOR QUE A PIPOCA DE CINEMA- CARAMELIZADA,2021-05-14T03:04:24.476Z
Leodenice Camargo, PIPOCA DOCE | MÉTODO FÁCIL E SEM ERROS,2021-05-14T02:54:12.514Z
Nandu Andrade, PIPOCA DOCE COM NESCAU SUPER FÁCIL | Nandu Andrade,2021-05-14T02:53:08.764Z
Culinária com Gilberto, PIPOCA DE CHOCOLATE CROCANTE,2021-05-14T02:52:58.564Z
Frigideira com Tampa Juliana Reis, COMO FAZER PIPOCA DOCE EM 1 PANELA SÓ - PRONTA EM MENOS DE 10 MINUTOS!!,2021-05-14T02:51:11.908Z
Metrô Espacial, As melhores SÉRIES Originais da Amazon Prime Video,2021-05-13T20:18:17.127Z
Luz Câmera Ação, TOP 5 MELHORES SÉRIES DE 2021 ( ATÉ AGORA ),2021-05-13T20:17:43.731Z
"Jhow Etc,s", IMPUROS  3 TEMPORADA  ( NOVIDADES 2021),2021-05-13T20:13:23.469Z
Gustavo G.N., Como Gravar seu Rap em casa - Bem Explicado! [AUDACITY],2021-05-13T11:53:10.068Z
Drak Tutoriais, Como gravar uma música - Audacity,2021-05-13T11:51:01.484Z
Flow Podcast e PodPah - Cortes, DELEGADO DA CUNHA SOBRE MONARK E FLOW PODCAST,2021-05-06T13:37:51.382Z
Flow Podcast e PodPah - Cortes, DELEGADO DA CUNHA SOBRE BRUNO FABIL NO PODPAH (DEBATE),2021-05-06T13:09:05.820Z
Flow Podcast e PodPah - Cortes, DELEGADO DA CUNHA - POLÍCIA PODE OBRIGAR A DESBLOQUEAR O CELULAR? E INVADIR CASA SEM MANDADO?,2021-05-06T13:08:42.588Z
adsense," PicPay – Todo mundo usa, todo lugar aceita",2021-05-06T13:07:42.221Z
Lucas Vitorino," COMO PEDIR COMIDA ""DE GRAÇA"" PARA PAGAR DEPOIS NO APP DE DELIVERY",2021-05-01T22:19:53.119Z
Nerdficando, TRAILER OFICIAL! NARUTO SHIPPUDEN DUBLADO PELA NETFLIX,2021-04-29T15:29:11.837Z
mimimidias, Midnight Gospel: palimpsesto de podcast,2021-04-25T01:59:39.829Z
Cortes do Flow [OFICIAL], O QUE É UM ESCRAVO MODERNO? | Cortes do Flow,2021-04-24T10:43:10.516Z
Cortes do Flow [OFICIAL], QUALQUER UM PODE IR A UM PODCAST? | Cortes do Flow,2021-04-24T10:20:00.203Z
Cortes do Flow [OFICIAL], VILELA EXPÕE TRETA COM ANTIGO SÓCIO E MOSTRA UMA TATTO | Cortes do Flow,2021-04-24T10:19:24.288Z
Vlad and Niki, Vlad and Niki - new Funny stories about Toys for children,2021-04-18T03:51:03.490Z
LUCCAS NETO - LUCCAS TOON, A ÁGUA É LAVA !! ( DESAFIO MAIS DIFÍCIL ),2021-04-18T03:49:17.287Z
Maria Clara & JP, ♫ MÚSICA O CHÃO É LAVA 🔥 The Floor is Lava - Children Song by Maria Clara e JP,2021-04-18T03:48:40.967Z
Maria Clara & JP, O CHÃO É LAVA COM MARIA CLARA E JP!  / The Floor is Lava Maria Clara and JP,2021-04-18T03:48:25.983Z
NaNa Star, Larva Characters in Real Life,2021-04-18T03:45:34.798Z
Nostalgia Rangers, Os Rangers Morfando Juntos Dublado | Power Rangers Morfagem Feroz 2 Temporada,2021-04-18T03:38:04.108Z
Cortes do Flow [OFICIAL]," LATINO VS CAUÊ MOURA, A VERDADE | Cortes do Flow",2021-04-15T13:31:48.645Z
Coisas de Pai e Filho, Acerte e ganhe 100 reais | # shorts,2021-04-14T00:40:03.169Z
COMIDA Á MODA DA CASA, Picanharia do Gaúcho!,2021-04-14T00:39:20.430Z
FUNK S2, Menino canta música do Salvador da Rima Estilo Coyote na frente da polícia,2021-04-14T00:38:37.100Z
Mikhael Lucas, Como aumentar o score do Ifood em 2021,2021-04-14T00:31:12.927Z
iFood para Entregadores, Como o iFood envia rotas para os entregadores e entregadoras?,2021-04-14T00:27:56.120Z
John Reivax, DATAPREV LIBEROU! Como Saber se Você Foi APROVADO no Auxílio Emergencial 2021?,2021-04-07T22:15:31.044Z
TEDx Talks, The first 20 hours -- how to learn anything | Josh Kaufman | TEDxCSU,2021-03-30T11:09:34.944Z
Charles Santos, DJONGA FALA SOBRE DELEGADO DA CUNHA com MITICO e IGÃO...,2021-03-30T01:24:47.482Z
Instituto Montanari, 19/03 PRORROGADO! AUXÍLIO EMERGENCIAL 2021 BOLSA FAMÍLIA QUEM VAI RECEBER? VEJA AQUI!,2021-03-19T11:42:12.835Z
